class,title,url,subreddit,score,permalink,Source
1,Essential workers get lost in the vaccine scrum as states prioritize the elderly,https://www.washingtonpost.com/health/2021/01/31/covid-vaccine-who-should-go-first/,Coronavirus,36,/r/Coronavirus/comments/l9gd2j/essential_workers_get_lost_in_the_vaccine_scrum/,washingtonpost.com
1,"Covid: Israel to transfer 5,000 vaccine doses to Palestinians",https://www.bbc.com/news/world-middle-east-55879337,Coronavirus,12,/r/Coronavirus/comments/l9gcar/covid_israel_to_transfer_5000_vaccine_doses_to/,bbc.com
1,"How the world's vaccine rollout hit division, delay and disarray",https://www.nbcnews.com/news/world/covid-vaccines-rollout-disarray-u-s-abroad-n1256144,Coronavirus,15,/r/Coronavirus/comments/l9g82v/how_the_worlds_vaccine_rollout_hit_division_delay/,nbcnews.com
1,"Stop posting pictures of your COVID-19 vaccine card on social media, BBB warns",https://www.khou.com/article/news/health/coronavirus/stop-posting-covid-19-vaccine-card-on-social-media/85-5fd0639f-23e6-43cb-a780-db3ffff0f578,Coronavirus,14,/r/Coronavirus/comments/l9g6z7/stop_posting_pictures_of_your_covid19_vaccine/,khou.com
1,"Chick-fil-A manager steps in to handle crowded drive thru vaccine site, reduces hours-long wait time to 15 minutes",https://www.cnn.com/2021/01/31/us/chick-fil-a-drive-thru-covid-vaccine-trnd/index.html,Coronavirus,121,/r/Coronavirus/comments/l9g51b/chickfila_manager_steps_in_to_handle_crowded/,cnn.com
1,"UK reports another 587 coronavirus deaths - as vaccine doses rise by more than 600,000 for first time",https://news.sky.com/story/covid-19-uk-reports-another-587-coronavirus-deaths-as-vaccine-doses-rise-by-more-than-600000-for-first-time-12204357,Coronavirus,10,/r/Coronavirus/comments/l9fl01/uk_reports_another_587_coronavirus_deaths_as/,sky.com
1,Novartis agrees to help Pfizer-BioNTech produce Covid-19 vaccine,https://www.swissinfo.ch/eng/business/novartis-agrees-to-help-pfizer-biontech-produce-covid-19-vaccine/46328798,Coronavirus,386,/r/Coronavirus/comments/l9ev4o/novartis_agrees_to_help_pfizerbiontech_produce/,swissinfo.ch
1,What went wrong with America’s $44 million vaccine data system?,https://www.technologyreview.com/2021/01/30/1017086/cdc-44-million-vaccine-data-vams-problems/,Coronavirus,35,/r/Coronavirus/comments/l9eftr/what_went_wrong_with_americas_44_million_vaccine/,technologyreview.com
1,"Reps. Stephen Lynch and Lori Trahan test positive for covid-19, one after receiving both doses of vaccine",https://www.washingtonpost.com/politics/2021/01/30/two-lawmakers-test-positive-coronavirus-one-after-receiving-both-doses-vaccine/,Coronavirus,76,/r/Coronavirus/comments/l9dvzx/reps_stephen_lynch_and_lori_trahan_test_positive/,washingtonpost.com
1,Some rural Texans are driving hundreds of miles for COVID-19 vaccine,https://abc13.com/10171842/,Coronavirus,520,/r/Coronavirus/comments/l9dfma/some_rural_texans_are_driving_hundreds_of_miles/,abc13.com
1,Covid: Warning over fake vaccine emails and text messages,https://www.bbc.co.uk/news/uk-wales-55878504,Coronavirus,10,/r/Coronavirus/comments/l9d2bu/covid_warning_over_fake_vaccine_emails_and_text/,co.uk
1,Man charged over suspect package sent to UK AstraZeneca vaccine plant,https://www.reuters.com/article/us-health-coronavirus-britain-astra-inci/man-charged-over-suspect-package-sent-to-uk-astrazeneca-vaccine-plant-idUSKBN29Z0GS,Coronavirus,25,/r/Coronavirus/comments/l9d1d7/man_charged_over_suspect_package_sent_to_uk/,reuters.com
1,Anti-vaccine protesters temporarily shut down Los Angeles vaccine site,https://www.wctv.tv/2021/01/31/anti-vaccine-protesters-temporarily-shut-down-los-angeles-vaccine-site/?fbclid=IwAR14rq4e3iuDl6CncGPCFw_3Pi8krXIQ5ARxv-70focUWZl8YbA_wqoR3_c,Coronavirus,26,/r/Coronavirus/comments/l9c7gz/antivaccine_protesters_temporarily_shut_down_los/,wctv.tv
1,"Bill Gates, Big Pharma and entrenching the vaccine apartheid - The Mail &  Guardian",https://mg.co.za/coronavirus-essentials/2021-01-30-bill-gates-big-pharma-and-entrenching-the-vaccine-apartheid/,Coronavirus,6,/r/Coronavirus/comments/l9bdqn/bill_gates_big_pharma_and_entrenching_the_vaccine/,co.za
1,A Third of Americans Say They Are Unlikely or Hesitant to Get COVID-19 Vaccine,https://www.ucdavis.edu/news/third-americans-say-they-are-unlikely-or-hesitant-get-covid-19-vaccine,Coronavirus,16,/r/Coronavirus/comments/l9apmn/a_third_of_americans_say_they_are_unlikely_or/,ucdavis.edu
1,'Vaccine tourism': tens of thousands of Americans cross state lines for injections,https://www.theguardian.com/us-news/2021/jan/31/us-vaccine-tourism-state-borders-covid-19-shots,Coronavirus,45,/r/Coronavirus/comments/l9aiit/vaccine_tourism_tens_of_thousands_of_americans/,theguardian.com
1,COVID-19: Rejected contracts and a Hollywood movie - how UK struck deal to guarantee vaccine supply,http://news.sky.com/story/covid-19-rejected-contracts-and-a-hollywood-movie-how-uk-struck-deal-to-guarantee-vaccine-supply-12204044,Coronavirus,39,/r/Coronavirus/comments/l99n5d/covid19_rejected_contracts_and_a_hollywood_movie/,sky.com
1,Worldwide Vaccine Tracker,https://www.nytimes.com/interactive/2021/world/covid-vaccinations-tracker.html,Coronavirus,4,/r/Coronavirus/comments/l8pxti/worldwide_vaccine_tracker/,nytimes.com
0,"Johnson & Johnson vaccine protects 100% from server COVID-19 which means 0 deaths in 44000 person trial. Yes, 1/3 came down with COVID but no server symptoms. Also J& J vaccine is only 1 shot. This would eliminate the risk of reaction appearing with second dose. Media",https://www.upworthy.com/johnson-johnsons-vaccine-news-is-a-reminder-to-read-articles-and-not-just-headlines?fbclid=IwAR03OP067fLN3h1KqBsWNR5hPqjD2e09N8A1oJKPTBYjfFfBKIp05iaQKR0,Coronavirus,17,/r/Coronavirus/comments/l8pfen/johnson_johnson_vaccine_protects_100_from_server/,upworthy.com
1,‘I got mine!!!’: OJ Simpson boasts about getting Covid-19 vaccine while wearing ‘The Juice’ face mask,https://www.independent.co.uk/news/world/americas/oj-simpson-covid-vaccine-b1795192.html,Coronavirus,6,/r/Coronavirus/comments/l8p1ky/i_got_mine_oj_simpson_boasts_about_getting/,co.uk
1,Canada needs domestic vaccine production capacity: task force doctor,https://www.theglobeandmail.com/canada/article-canada-needs-domestic-vaccine-production-capacity-task-force-doctor/,Coronavirus,5,/r/Coronavirus/comments/l8nm6d/canada_needs_domestic_vaccine_production_capacity/,theglobeandmail.com
1,A fight between the EU and UK reveals the ugly truth about vaccine nationalism,https://edition.cnn.com/2021/01/30/europe/uk-eu-astrazeneca-vaccine-nationalism-gbr-intl/index.html,Coronavirus,5,/r/Coronavirus/comments/l8nf5e/a_fight_between_the_eu_and_uk_reveals_the_ugly/,cnn.com
1,"Luck, foresight and science: How an unheralded team developed a COVID-19 vaccine in record time",https://www.usatoday.com/in-depth/news/investigations/2021/01/26/moderna-covid-vaccine-science-fast/6555783002/,Coronavirus,4,/r/Coronavirus/comments/l8nafi/luck_foresight_and_science_how_an_unheralded_team/,usatoday.com
1,"Despite advances, it will be 'months' before everyone who wants a vaccine can get one, task force says",https://www.cnn.com/2021/01/27/politics/covid-19-briefing-biden-administration/index.html,Coronavirus,4,/r/Coronavirus/comments/l77rms/despite_advances_it_will_be_months_before/,cnn.com
1,"Biontech aims to deliver ""more than 100 percent"" of promised vaccine doses (article in German)",https://www.spiegel.de/wissenschaft/corona-news-am-mittwoch-die-wichtigsten-entwicklungen-zu-sars-cov-2-und-covid-19-a-8a18952a-b1d6-4dbf-9270-41cbe46737ed,Coronavirus,7,/r/Coronavirus/comments/l77acg/biontech_aims_to_deliver_more_than_100_percent_of/,spiegel.de
1,Canada falls to 20th in the world for vaccine doses administered,https://www.cbc.ca/news/politics/canada-20-world-vaccine-doses-administered-1.5891465,Coronavirus,7,/r/Coronavirus/comments/l76om2/canada_falls_to_20th_in_the_world_for_vaccine/,cbc.ca
1,VIRUS TODAY: Lawmakers call for race data on vaccine access,https://apnews.com/article/3f418dbc3675c661870e3aa42f9a8ca0,Coronavirus,8,/r/Coronavirus/comments/l76chp/virus_today_lawmakers_call_for_race_data_on/,apnews.com
1,"(27 January 2021) Pfizer's Covid-19 vaccine production back on track at its Puurs, Belgium, facility",https://www.brusselstimes.com/belgium/151481/pfizer-biontechs-vaccine-production-back-on-track-puurs-belgium-doses/,Coronavirus,9,/r/Coronavirus/comments/l7549k/27_january_2021_pfizers_covid19_vaccine/,brusselstimes.com
1,Astra-Zeneca to deliver more vaccine and publish contract,https://www.faz.net/aktuell/wirtschaft/unternehmen/astra-zeneca-will-mehr-corona-impfstoff-liefern-17169846.html,Coronavirus,10,/r/Coronavirus/comments/l74quf/astrazeneca_to_deliver_more_vaccine_and_publish/,faz.net
1,EU to control COVID-19 vaccine export,https://www.aa.com.tr/en/europe/eu-to-control-covid-19-vaccine-export/2126450,Coronavirus,6,/r/Coronavirus/comments/l74ow3/eu_to_control_covid19_vaccine_export/,com.tr
1,Boris Johnson raises security concern as Nicola Sturgeon says she'll republish vaccine supply figures,https://www.scotsman.com/news/politics/boris-johnson-raises-security-concern-nicola-sturgeon-says-shell-republish-vaccine-supply-figures-3115984,Coronavirus,5,/r/Coronavirus/comments/l74b3s/boris_johnson_raises_security_concern_as_nicola/,scotsman.com
1,"No vaccine, no in-person education, teachers say",https://www.nbcnews.com/news/us-news/teachers-say-they-want-covid-19-vaccine-they-head-back-n1255915,Coronavirus,7,/r/Coronavirus/comments/l74abm/no_vaccine_no_inperson_education_teachers_say/,nbcnews.com
1,Philippines approves AstraZeneca COVID-19 vaccine for emergency use,https://www.rappler.com/nation/philippines-approves-astrazeneca-covid-19-vaccine-emergency-use,Coronavirus,12,/r/Coronavirus/comments/l6nul4/philippines_approves_astrazeneca_covid19_vaccine/,rappler.com
1,Washington state hospital apologizes after inviting donors to sign up for Covid-19 vaccine,http://rss.cnn.com/~r/rss/cnn_latest/~3/UDIVfy33ftQ/index.html,Coronavirus,6,/r/Coronavirus/comments/l6nqus/washington_state_hospital_apologizes_after/,cnn.com
1,US applauds 'true friend' India for gifting COVID-19 vaccine to several countries,https://economictimes.indiatimes.com/news/politics-and-nation/us-applauds-true-friend-india-for-gifting-covid-19-vaccine-to-several-countries/articleshow/80417770.cms,Coronavirus,42,/r/Coronavirus/comments/l6ndw9/us_applauds_true_friend_india_for_gifting_covid19/,indiatimes.com
1,Sri Lanka thanks India for sending coronavirus vaccine,https://www.outlookindia.com/newsscroll/sri-lanka-thanks-india-for-sending-coronavirus-vaccine/2017573,Coronavirus,14,/r/Coronavirus/comments/l6nd7b/sri_lanka_thanks_india_for_sending_coronavirus/,outlookindia.com
1,EU Demands Access to AstraZeneca’s U.K. Vaccine Supplies in Call,https://www.bloomberg.com/news/articles/2021-01-27/eu-astra-vaccine-dispute-descends-into-chaos-over-crunch-call,Coronavirus,4,/r/Coronavirus/comments/l6n937/eu_demands_access_to_astrazenecas_uk_vaccine/,bloomberg.com
1,"In week after 2nd Pfizer vaccine shot, only 20 of 128,000 Israelis get COVID",https://www.timesofisrael.com/week-after-2nd-pfizer-vaccine-shot-only-20-of-128000-israelis-get-covid/,Coronavirus,30,/r/Coronavirus/comments/l6mkgq/in_week_after_2nd_pfizer_vaccine_shot_only_20_of/,timesofisrael.com
1,"Dry ice, containers and staff shortages: Japan's vaccine rollout hurdles",https://www.japantimes.co.jp/news/2021/01/27/national/japan-vaccine-hurdles/,Coronavirus,7,/r/Coronavirus/comments/l6meif/dry_ice_containers_and_staff_shortages_japans/,co.jp
0,Chinese vaccine trial in Dhaka fell through. Its state media blames New Delhi,https://www.hindustantimes.com/world-news/indian-meddling-torpedoed-china-s-vaccine-trials-in-bangladesh-chinese-media-101611737215412.html,Coronavirus,7,/r/Coronavirus/comments/l6macx/chinese_vaccine_trial_in_dhaka_fell_through_its/,hindustantimes.com
1,AstraZeneca vaccine to be produced in Japan | NHK WORLD-JAPAN News,https://www3.nhk.or.jp/nhkworld/en/news/20210128_03/,Coronavirus,11,/r/Coronavirus/comments/l6lpop/astrazeneca_vaccine_to_be_produced_in_japan_nhk/,or.jp
1,Update: Missoula's first public vaccine clinic fills within hour (Montana),https://missoulian.com/news/local/update-missoulas-first-public-vaccine-clinic-fills-within-hour/article_e4983124-7c6c-5965-8ebd-5d1b5c7044e9.html#tracking-source=home-top-story-1,Coronavirus,9,/r/Coronavirus/comments/l6k9ae/update_missoulas_first_public_vaccine_clinic/,missoulian.com
1,Vaccine war brewing as EU demands Covid jabs produced in UK,https://www.independent.co.uk/news/uk/politics/covid-vaccine-eu-boris-johnson-b1793652.html,Coronavirus,16,/r/Coronavirus/comments/l6jwll/vaccine_war_brewing_as_eu_demands_covid_jabs/,co.uk
1,10 people infected in Swedish nursing home despite having received two vaccine doses,https://www.dn.se/sverige/tio-covidsmittade-pa-vardboende-trots-tva-vaccindoser,Coronavirus,33,/r/Coronavirus/comments/l6ju0h/10_people_infected_in_swedish_nursing_home/,dn.se
1,"UK supply of Covid vaccine ‘more than is needed’ - ""The British government believes its contracts with Astrazeneca give it a right to the first 100 million doses produced in Britain""",https://www.thetimes.co.uk/article/eu-tells-britain-give-us-your-covid-vaccines-jkhfdlm7w,Coronavirus,13,/r/Coronavirus/comments/l6jl39/uk_supply_of_covid_vaccine_more_than_is_needed/,co.uk
1,COVID-19 Vaccine Distribution: How High-Tech California Is Now Trying To Fix It,https://www.npr.org/2021/01/27/961236772/covid-19-vaccine-distribution-how-high-tech-california-is-now-trying-to-fix-it,Coronavirus,8,/r/Coronavirus/comments/l6j7vy/covid19_vaccine_distribution_how_hightech/,npr.org
1,Pfizer vaccine only slightly less effective against key South African mutations: study,https://www.reuters.com/article/reutersComService_2_MOLT/idUSKBN29W31M,Coronavirus,194,/r/Coronavirus/comments/l6iiyv/pfizer_vaccine_only_slightly_less_effective/,reuters.com
1,Hundreds of Holocaust survivors to get COVID-19 vaccine,https://www.king5.com/article/news/health/coronavirus/vaccine/shoah-survivors-to-get-vaccine/507-b46fc60b-850d-477d-9b27-8f7251c035e5,Coronavirus,57,/r/Coronavirus/comments/l6iie1/hundreds_of_holocaust_survivors_to_get_covid19/,king5.com
1,Japan to produce 90m doses of AstraZeneca COVID-19 vaccine,https://asia.nikkei.com/Spotlight/Coronavirus/Japan-to-produce-90m-doses-of-AstraZeneca-COVID-19-vaccine,Coronavirus,31,/r/Coronavirus/comments/l6hxa6/japan_to_produce_90m_doses_of_astrazeneca_covid19/,nikkei.com
1,Johnson & Johnson Expects to Report Covid-19 Vaccine Results by Next Week,https://www.wsj.com/articles/johnson-johnson-profit-is-boosted-by-pharmaceuticals-business-11611666309,Coronavirus,57,/r/Coronavirus/comments/l6huci/johnson_johnson_expects_to_report_covid19_vaccine/,wsj.com
1,D.C.'s Federal Vaccine Allotment To Increase By 15%,https://dcist.com/story/21/01/27/biden-increases-dc-vaccine-allotment/,Coronavirus,15,/r/Coronavirus/comments/l6gxcv/dcs_federal_vaccine_allotment_to_increase_by_15/,dcist.com
1,"Report: PA plans to buy 100,000 of Russia's Sputnik V vaccine",https://www.israelhayom.com/2021/01/27/report-pa-plans-to-buy-100000-of-russias-sputnik-v-vaccine/,Coronavirus,5,/r/Coronavirus/comments/l6gwic/report_pa_plans_to_buy_100000_of_russias_sputnik/,israelhayom.com
1,"Hungary buys Russia’s Sputnik V COVID vaccine, first in EU",https://www.aljazeera.com/news/2021/1/22/hungary-buys-russias-sputnik-v-covid-vaccine-first-in-eu,Coronavirus,36,/r/Coronavirus/comments/l6fy4h/hungary_buys_russias_sputnik_v_covid_vaccine/,aljazeera.com
1,"NJ hospital gave vaccine to wealthy donors, ineligible relatives in December",https://nj1015.com/hunterdon-medica-center-covid-19-vaccine/,Coronavirus,39,/r/Coronavirus/comments/l6fvhw/nj_hospital_gave_vaccine_to_wealthy_donors/,nj1015.com
1,Iran approves Russia’s Sputnik V COVID-19 vaccine,https://www.aljazeera.com/news/2021/1/26/iran-approves-russias-sputnik-v-covid-19-vaccine,Coronavirus,15,/r/Coronavirus/comments/l6f0lc/iran_approves_russias_sputnik_v_covid19_vaccine/,aljazeera.com
1,"With this letter by Jens Spahn, the vaccine disaster in the EU began",https://www.bild.de/politik/ausland/politik-inland/with-this-letter-by-jens-spahn-the-vaccine-disaster-in-the-eu-begann-74736986.bild.html,Coronavirus,30,/r/Coronavirus/comments/l6es3d/with_this_letter_by_jens_spahn_the_vaccine/,bild.de
1,"CDC Says Distributed 47,230,950 Doses Of COVID-19 Vaccine As Of Jan 27",https://www.reuters.com/article/idUSL4N2K24BS,Coronavirus,59,/r/Coronavirus/comments/l6dz1a/cdc_says_distributed_47230950_doses_of_covid19/,reuters.com
1,"EU commissioner: AstraZeneca logic might work at the butcher’s, but not in vaccine contracts",https://www.politico.eu/article/health-commissioner-astrazeneca-logic-might-work-at-butcher-but-not-in-contracts/,Coronavirus,28,/r/Coronavirus/comments/l6cwlt/eu_commissioner_astrazeneca_logic_might_work_at/,politico.eu
1,Most nursing home workers don’t want the vaccine. Here’s what facilities are doing about it.,https://www.washingtonpost.com/local/nursing-homes-vaccine-decline/2021/01/27/22a602f6-5fe2-11eb-afbe-9a11a127d146_story.html,Coronavirus,11,/r/Coronavirus/comments/l6cq14/most_nursing_home_workers_dont_want_the_vaccine/,washingtonpost.com
1,Alabama hospital offers tickets for COVID vaccine,https://www.al.com/news/2021/01/alabama-hospital-offers-tickets-for-covid-vaccine.html,Coronavirus,9,/r/Coronavirus/comments/l6cjay/alabama_hospital_offers_tickets_for_covid_vaccine/,al.com
1,UK experts defend 12-week delay for second vaccine dose,https://www.ft.com/content/ca3c466d-7a37-4485-b878-eb3f6c02bc8b,Coronavirus,11,/r/Coronavirus/comments/l6c2oe/uk_experts_defend_12week_delay_for_second_vaccine/,ft.com
1,Coronavirus: EU demands UK-made AstraZeneca vaccine doses,https://www.bbc.co.uk/news/world-europe-55822602,Coronavirus,15,/r/Coronavirus/comments/l6bh1e/coronavirus_eu_demands_ukmade_astrazeneca_vaccine/,co.uk
1,"Nearly half of Americans want COVID-19 vaccine ASAP, numbers rising since December",https://medicalxpress.com/news/2021-01-americans-covid-vaccine-asap-december.html,Coronavirus,5,/r/Coronavirus/comments/l6anw9/nearly_half_of_americans_want_covid19_vaccine/,medicalxpress.com
1,J& J Vaccine Trial Has Enough Data to Analyze Soon: Fauci,https://www.bloomberg.com/news/articles/2021-01-21/j-j-vaccine-trial-has-enough-data-to-analyze-soon-fauci-says,Coronavirus,5,/r/Coronavirus/comments/l28nx7/jj_vaccine_trial_has_enough_data_to_analyze_soon/,bloomberg.com
1,"New York seeing federal COVID-19 vaccine supply shortfall - NEWS10 - January 21, 2021",https://www.news10.com/news/new-york-seeing-federal-covid-19-vaccine-supply-shortfall/,Coronavirus,4,/r/Coronavirus/comments/l27kby/new_york_seeing_federal_covid19_vaccine_supply/,news10.com
1,Mount Sinai (Miami Beach) cancels 1st-dose COVID-19 vaccine appointments due to ‘uncertainty of supply’,https://www.local10.com/news/local/2021/01/21/mount-sinai-cancels-first-dose-covid-19-vaccine-appointments-due-to-uncertainty-of-supply/,Coronavirus,5,/r/Coronavirus/comments/l27beh/mount_sinai_miami_beach_cancels_1stdose_covid19/,local10.com
1,"New COVID-19 variant defeats plasma treatment, may reduce vaccine efficacy",https://www.reuters.com/article/uk-health-coronavirus-safrica-variant/new-covid-19-variant-defeats-plasma-treatment-may-reduce-vaccine-efficacy-idUSKBN29Q0SK,Coronavirus,4,/r/Coronavirus/comments/l25xh1/new_covid19_variant_defeats_plasma_treatment_may/,reuters.com
1,CNN Poll: Americans' willingness to get the coronavirus vaccine is on the rise,https://www.cnn.com/2021/01/21/politics/cnn-poll-coronavirus-vaccine/index.html,Coronavirus,7,/r/Coronavirus/comments/l25rr8/cnn_poll_americans_willingness_to_get_the/,cnn.com
0,COVID-19: Study shows one vaccine dose leaves UK's over-60s 'seriously vulnerable' | UK News,https://news.sky.com/story/covid-19-analysis-shows-one-vaccine-dose-leaves-uks-over-60s-seriously-vulnerable-12192949,Coronavirus,4,/r/Coronavirus/comments/l24rwl/covid19_study_shows_one_vaccine_dose_leaves_uks/,sky.com
0,"New COVID-19 Variant Defeats Plasma Treatment, May Reduce Vaccine Efficacy",https://www.usnews.com/news/world/articles/2021-01-20/new-covid-19-variant-defeats-plasma-treatment-may-reduce-vaccine-efficacy,Coronavirus,11,/r/Coronavirus/comments/l1mwgv/new_covid19_variant_defeats_plasma_treatment_may/,usnews.com
0,Some COVID-19 Mutations May Dampen Vaccine Effectiveness,https://www.usnews.com/news/us/articles/2021-01-20/some-covid-19-mutations-may-dampen-vaccine-effectiveness,Coronavirus,4,/r/Coronavirus/comments/l1l1ca/some_covid19_mutations_may_dampen_vaccine/,usnews.com
1,"‘Come with me if you want to live’: Schwarzenegger gets COVID vaccine, urges others to follow suit",https://ktla.com/news/local-news/come-with-me-if-you-want-to-live-schwarzenegger-gets-covid-vaccine-urges-others-to-follow-suit/,Coronavirus,10,/r/Coronavirus/comments/l1kv23/come_with_me_if_you_want_to_live_schwarzenegger/,ktla.com
1,Moderna says possible allergic reactions to COVID-19 vaccine under investigation,https://www.reuters.com/article/us-health-coronavirus-moderna/moderna-says-possible-allergic-reactions-to-covid-19-vaccine-under-investigation-idINKBN29O2C5,Coronavirus,6,/r/Coronavirus/comments/l1k81e/moderna_says_possible_allergic_reactions_to/,reuters.com
1,U.S. CDC Says Administered 16.5 Million Doses Of Covid-19 Vaccine As Of Jan 20,https://www.marketscreener.com/news/latest/U-S-CDC-Says-Administered-16-5-Million-Doses-Of-Covid-19-Vaccine-As-Of-Jan-20--32239208/,Coronavirus,5,/r/Coronavirus/comments/l1gbzk/us_cdc_says_administered_165_million_doses_of/,marketscreener.com
0,"New COVID-19 variant defeats plasma treatment, may reduce vaccine efficacy",https://www.reuters.com/article/us-health-coronavirus-safrica-variant-idUSKBN29P2HJ,Coronavirus,5,/r/Coronavirus/comments/l1fcuy/new_covid19_variant_defeats_plasma_treatment_may/,reuters.com
1,Elderly begin to drop out of Novavax vaccine trial to get Pfizer and Moderna shots,https://www.washingtonpost.com/business/2021/01/19/novavax-vaccines-clinical-trials/,Coronavirus,4,/r/Coronavirus/comments/l0zn7v/elderly_begin_to_drop_out_of_novavax_vaccine/,washingtonpost.com
1,Mexico Temporarily Suspends Pfizer Vaccine Purchases to Help Supply Doses to Poor Countries,https://www.voanews.com/covid-19-pandemic/mexico-temporarily-suspends-pfizer-vaccine-purchases-help-supply-doses-poor,Coronavirus,5,/r/Coronavirus/comments/l0z8tl/mexico_temporarily_suspends_pfizer_vaccine/,voanews.com
1,Pharmacist charged in attempt to ruin COVID-19 vaccine,https://www.independent.co.uk/news/pharmacist-charged-in-attempt-to-ruin-covid19-vaccine-brandenburg-vaccine-covid-madison-vaccine-b1789764.html,Coronavirus,5,/r/Coronavirus/comments/l0z6vy/pharmacist_charged_in_attempt_to_ruin_covid19/,co.uk
1,Can my employer make me get a COVID-19 vaccine?,https://news.trust.org/item/20210119174126-u21v4/,Coronavirus,6,/r/Coronavirus/comments/l0z4o9/can_my_employer_make_me_get_a_covid19_vaccine/,trust.org
1,"4,400 Moderna Vaccine Doses Not Kept Cold Enough May Be Unusable",https://www.npr.org/2021/01/19/958539556/4-400-moderna-vaccine-doses-not-kept-cold-enough-may-be-unusable,Coronavirus,8,/r/Coronavirus/comments/l0yxyg/4400_moderna_vaccine_doses_not_kept_cold_enough/,npr.org
1,Massachusetts to send COVID vaccine to CVS and Walgreens across state; adds Fenway as mass vaccination site,https://www.masslive.com/coronavirus/2021/01/massachusetts-to-send-covid-vaccine-to-cvs-and-wallgreens-across-state-adds-fenway-as-mass-vaccination-site.html,Coronavirus,5,/r/Coronavirus/comments/l0x7sk/massachusetts_to_send_covid_vaccine_to_cvs_and/,masslive.com
1,Pharmacist charged with misdemeanor after leaving COVID vaccine unrefrigerated,https://www.gmtoday.com/news/pharmacist-charged-with-misdemeanor-after-leaving-covid-vaccine-unrefrigerated/article_c303bd18-5a8a-11eb-a465-6344964e5e20.html,Coronavirus,12,/r/Coronavirus/comments/l0vu27/pharmacist_charged_with_misdemeanor_after_leaving/,gmtoday.com
1,"Deep in remote Amazon, indigenous villagers receive coronavirus vaccine",https://www.reuters.com/article/us-health-coronavirus-brazil-indigenous/deep-in-remote-amazon-indigenous-villagers-receive-coronavirus-vaccine-idUSKBN29O2PU?il=0,Coronavirus,8,/r/Coronavirus/comments/l0vrcm/deep_in_remote_amazon_indigenous_villagers/,reuters.com
1,Brazil Government Fails to Deliver Vaccine to All States on Monday,https://www1.folha.uol.com.br/internacional/en/scienceandhealth/2021/01/brazil-government-fails-to-deliver-vaccine-to-all-states-on-monday.shtml?utm_source=newsletter&amp;utm_medium=email&amp;utm_campaign=newsen,Coronavirus,7,/r/Coronavirus/comments/l0vikq/brazil_government_fails_to_deliver_vaccine_to_all/,com.br
1,Aurora nursing home residents get a shot at ‘normalcy’ with the COVID-19 vaccine,https://www.chicagotribune.com/suburbs/aurora-beacon-news/opinion/ct-abn-crosby-cowherd-vaccine-st-0120-20210119-z6vhw2rpqnblzbinwcjje77h5m-story.html,Coronavirus,6,/r/Coronavirus/comments/l0uxhc/aurora_nursing_home_residents_get_a_shot_at/,chicagotribune.com
0,Single Covid vaccine dose in Israel 'less effective than we thought',https://www.theguardian.com/world/2021/jan/19/single-covid-vaccine-dose-in-israel-less-effective-than-we-hoped?CMP=Share_iOSApp_Other,Coronavirus,6,/r/Coronavirus/comments/l0u9st/single_covid_vaccine_dose_in_israel_less/,theguardian.com
1,Pfizer will not ship any vaccine doses to Canada next week,https://www.richmond-news.com/coronavirus-covid-19-local-news/pfizer-will-not-ship-any-vaccine-doses-to-canada-next-week-3275444,Coronavirus,6,/r/Coronavirus/comments/l0tf5x/pfizer_will_not_ship_any_vaccine_doses_to_canada/,richmond-news.com
