class,title,url,subreddit,score,permalink,Source
1,Colorado State University Researchers Closing In On Coronavirus Vaccine,https://denver.cbslocal.com/2020/04/09/colorado-state-university-researchers-coronavirus-vaccine/,Coronavirus,24,/r/Coronavirus/comments/g1cxjv/colorado_state_university_researchers_closing_in/,cbslocal.com
1,Cuba obtains first results of vaccine for innate immunity,https://www.prensa-latina.cu/index.php?o=rn&amp;id=357882&amp;SEO=cuba-obtiene-primeros-resultados-de-vacuna-para-inmunidad-innata,Coronavirus,28,/r/Coronavirus/comments/g1ctfh/cuba_obtains_first_results_of_vaccine_for_innate/,prensa-latina.cu
1,Two top pharmaceutical companies teaming up to attempt to develop COVID-19 vaccine,https://www.sanofi.com/en/media-room/press-releases/2020/2020-04-14-13-00-00,Coronavirus,6,/r/Coronavirus/comments/g1cpg2/two_top_pharmaceutical_companies_teaming_up_to/,sanofi.com
1,"Sanofi, GSK partner to produce coronavirus vaccine by late 2021",https://www.upi.com/Top_News/World-News/2020/04/14/Sanofi-GSK-partner-to-produce-coronavirus-vaccine-by-late-2021/9391586867362/?ds=4,Coronavirus,6,/r/Coronavirus/comments/g1cfty/sanofi_gsk_partner_to_produce_coronavirus_vaccine/,upi.com
1,J& J can produce up to 900 million coronavirus vaccine doses by April 2021 if trials go well,https://www.cnbc.com/2020/04/14/jj-can-produce-up-to-900-million-coronavirus-vaccine-doses-by-april-2021-if-trials-go-well.html,Coronavirus,133,/r/Coronavirus/comments/g1cc55/jj_can_produce_up_to_900_million_coronavirus/,cnbc.com
1,Anti-vaxxers spread fear about future coronavirus vaccine,https://www.cbsnews.com/news/anti-vaxxer-fear-coronavirus-vaccine/,Coronavirus,10,/r/Coronavirus/comments/g1bau1/antivaxxers_spread_fear_about_future_coronavirus/,cbsnews.com
1,Chinese COVID-19 vaccine enters phase 2 clinical trial,http://scitech.people.com.cn/n1/2020/0414/c1007-31673429.html,Coronavirus,19,/r/Coronavirus/comments/g19z1x/chinese_covid19_vaccine_enters_phase_2_clinical/,com.cn
1,"WHO: The world cannot wait for universal testing or a vaccine to ""come out of lockdown""",https://www.rte.ie/news/coronavirus/2020/0414/1130374-coronavirus-who-envoy/,Coronavirus,14,/r/Coronavirus/comments/g19y10/who_the_world_cannot_wait_for_universal_testing/,rte.ie
1,New article published in Science suggests we may need to keep social distancing until 2022 if a vaccine is not developed quickly enough unless we substantially increase critical care capacity,https://science.sciencemag.org/content/early/2020/04/14/science.abb5793,Coronavirus,83,/r/Coronavirus/comments/g19jlf/new_article_published_in_science_suggests_we_may/,sciencemag.org
1,Coronavirus Vaccine? Two Pharmaceutical Giants Collaborating To Develop One,https://www.npr.org/sections/coronavirus-live-updates/2020/04/14/834160187/coronavirus-vaccine-two-pharmaceutical-giants-collaborating-to-develop-one?utm_medium=RSS&amp;utm_campaign=nprblogscoronavirusliveupdates,Coronavirus,166,/r/Coronavirus/comments/g199nc/coronavirus_vaccine_two_pharmaceutical_giants/,npr.org
1,GSK and Sanofi team up on Covid-19 vaccine,https://www.ft.com/content/c67a3dff-558d-42bb-95a6-36e55ac23639,Coronavirus,11,/r/Coronavirus/comments/g18y01/gsk_and_sanofi_team_up_on_covid19_vaccine/,ft.com
1,Mutation strain from India could kill current research efforts for coronavirus vaccine: report,https://www.foxnews.com/science/mutation-strain-from-india-could-kill-current-research-efforts-for-coronavirus-vaccine-report,Coronavirus,9,/r/Coronavirus/comments/g17zhp/mutation_strain_from_india_could_kill_current/,foxnews.com
1,"Live-attenuated vaccine phase 1 clinical trial now under way, 32 volunteers vaccinated",https://m.weibo.cn/status/4493715512830278,Coronavirus,72,/r/Coronavirus/comments/g17fac/liveattenuated_vaccine_phase_1_clinical_trial_now/,weibo.cn
1,"Coronavirus vaccine unlikely to be available within next 12 months, says WHO",https://www.independent.co.uk/news/health/coronavirus-vaccine-who-when-tests-covid-19-a9464056.html,Coronavirus,1516,/r/Coronavirus/comments/g1600p/coronavirus_vaccine_unlikely_to_be_available/,co.uk
1,Could a 100-year-old vaccine protect against COVID-19?,https://www.livescience.com/coronavirus-protection-using-tuberculosis-vaccine.html,Coronavirus,15,/r/Coronavirus/comments/g15g85/could_a_100yearold_vaccine_protect_against_covid19/,livescience.com
1,"'Mixed picture' in Europe, COVID-19 vaccine at least 12 months off - WHO",https://uk.reuters.com/article/uk-health-coronavirus-who/mixed-picture-in-europe-covid-19-vaccine-at-least-12-months-off-who-idUKKCN21W171?il=0,Coronavirus,23,/r/Coronavirus/comments/g132o9/mixed_picture_in_europe_covid19_vaccine_at_least/,reuters.com
1,"Bill Gates on Finding a Vaccine for COVID-19, the Economy, and Returning to 'Normal Life'",https://haizrulamrie.com/watch?v=5oEcxMfwJnw,Coronavirus,14,/r/Coronavirus/comments/g12lvj/bill_gates_on_finding_a_vaccine_for_covid19_the/,haizrulamrie.com
1,Can an oral polio vaccine helo stop the Coronavirus?,https://www.pbs.org/wnet/amanpour-and-company/video/can-oral-polio-vaccine-help-stop-coronavirus-9owwvp/,Coronavirus,7,/r/Coronavirus/comments/g113h3/can_an_oral_polio_vaccine_helo_stop_the/,pbs.org
1,"Coronavirus vaccine: The race to keep millions safe from COVID-19 - Sky News - Apr. 14, 2020",https://news.sky.com/story/coronavirus-vaccine-the-race-to-keep-millions-safe-from-covid-19-11968262,Coronavirus,8,/r/Coronavirus/comments/g0ztw1/coronavirus_vaccine_the_race_to_keep_millions/,sky.com
1,WHO warns coronavirus could stay for a long time until vaccine is developed,https://www.nbcnews.com/nightly-news/video/who-warns-coronavirus-could-stay-for-a-long-time-until-vaccine-is-developed-81956933643,Coronavirus,109,/r/Coronavirus/comments/g0zqag/who_warns_coronavirus_could_stay_for_a_long_time/,nbcnews.com
1,"China tightens Russian border checks, approves experimental coronavirus vaccine trials",https://www.reuters.com/article/us-health-coronavirus-china/china-tightens-russian-border-checks-approves-experimental-coronavirus-vaccine-trials-idUSKCN21W08N,Coronavirus,14,/r/Coronavirus/comments/g0yxdi/china_tightens_russian_border_checks_approves/,reuters.com
1,Coronavirus vaccine: China approve human testing for two experimental COVID vaccinations,https://7news.com.au/news/health/coronavirus-vaccine-china-approve-human-testing-for-two-experimental-covid-vaccinations-c-974624,Coronavirus,20,/r/Coronavirus/comments/g0yp73/coronavirus_vaccine_china_approve_human_testing/,com.au
1,The coronavirus mutation that threatens the race to develop vaccine - A strain found in India showed changes in the mechanism used to bind the virus to human cells which could render current research futile,https://www.scmp.com/news/china/science/article/3079678/coronavirus-mutation-threatens-race-develop-vaccine,Coronavirus,18,/r/Coronavirus/comments/g0yk65/the_coronavirus_mutation_that_threatens_the_race/,scmp.com
1,Florida Surgeon General Removed from Governor DeSantis' Coronavirus Briefing After Saying Social Distancing Necessary Until There's A Vaccine,https://www.newsweek.com/florida-surgeon-general-removed-governor-desantis-coronavirus-briefing-after-saying-social-1497629,Coronavirus,37637,/r/Coronavirus/comments/g0yg4t/florida_surgeon_general_removed_from_governor/,newsweek.com
1,Covid 19 Coronavirus: Mutation Threatens Race To Develop Vaccine,https://www.nzherald.co.nz/world/news/article.cfm?c_id=2&amp;objectid=12324650,Coronavirus,10,/r/Coronavirus/comments/g0y3vf/covid_19_coronavirus_mutation_threatens_race_to/,co.nz
1,Florida surgeon general says keep social distancing until there’s a vaccine — in a year,https://www.miamiherald.com/news/politics-government/state-politics/article241974621.html,Coronavirus,908,/r/Coronavirus/comments/g0y1mx/florida_surgeon_general_says_keep_social/,miamiherald.com
0,Human testing in China's vaccine hunt,https://www.news.com.au/world/breaking-news/human-testing-in-chinas-vaccine-hunt/news-story/8f7e752a4b2644f06e02630c34119afc,Coronavirus,7,/r/Coronavirus/comments/g0wy15/human_testing_in_chinas_vaccine_hunt/,com.au
1,Vanquishing the Virus: 160+ COVID-19 Drug and Vaccine Candidates in Development,https://www.genengnews.com/a-lists/vanquishing-the-virus-160-covid-19-drug-and-vaccine-candidates-in-development/?fbclid=IwAR3fSiAtJsRMQZ21RtjHOl6SimQbmd3ycAT4_P3H1SUI6luNDHEDXY1cAWQ,Coronavirus,61,/r/Coronavirus/comments/g0t1t7/vanquishing_the_virus_160_covid19_drug_and/,genengnews.com
1,"Floridians should keep social distancing until a vaccine exists, surgeon general says before being removed from news conference",https://www.tampabay.com/news/health/2020/04/13/floridians-should-keep-social-distancing-until-a-vaccine-exists-surgeon-general-says/,Coronavirus,46,/r/Coronavirus/comments/g0rts4/floridians_should_keep_social_distancing_until_a/,tampabay.com
1,Vaccine needed to end social distancing: Irish health minister,https://www.reuters.com/article/us-health-coronavirus-ireland/vaccine-needed-to-end-social-distancing-irish-health-minister-idUSKCN21V1TG,Coronavirus,37,/r/Coronavirus/comments/g0otye/vaccine_needed_to_end_social_distancing_irish/,reuters.com
1,Canadian at work on COVID-19 vaccine is optimistic,https://www.nationalobserver.com/2020/04/13/features/canadian-work-covid-19-vaccine-optimistic,Coronavirus,39,/r/Coronavirus/comments/g0omk7/canadian_at_work_on_covid19_vaccine_is_optimistic/,nationalobserver.com
1,"Italian-British coronavirus vaccine, human test in April: time for large-scale employment",https://www.ilmessaggero.it/salute/ricerca/covid_19_vaccino_italia_inghilterra_pomezia_test_rapidi_via_aprile_13_aprile_2020-5168399.html,Coronavirus,17,/r/Coronavirus/comments/g0ncej/italianbritish_coronavirus_vaccine_human_test_in/,ilmessaggero.it
1,"Coronavirus, the first human vaccine tests at the end of the month",https://www.repubblica.it/salute/medicina-e-ricerca/2020/04/13/news/coronavirus_a_fine_mese_i_primi_test_del_vaccino_sull_uomo-253880656/,Coronavirus,11,/r/Coronavirus/comments/g0j76i/coronavirus_the_first_human_vaccine_tests_at_the/,repubblica.it
1,Fewer coronavirus deaths seen in countries that mandate tuberculosis vaccine,https://www.japantimes.co.jp/news/2020/04/09/world/science-health-world/fewer-coronavirus-deaths-seen-countries-mandate-tuberculosis-vaccine/#.XpQd7kD7TIV,Coronavirus,31,/r/Coronavirus/comments/g0epk1/fewer_coronavirus_deaths_seen_in_countries_that/,co.jp
1,UK Government urged to follow Sir Alexander Fleming's example and produce a coronavirus vaccine for all,https://www.thecourier.co.uk/fp/news/politics/scottish-politics/1261498/uk-government-urged-to-follow-sir-alexander-flemings-example-and-produce-a-coronavirus-vaccine-for-all/,Coronavirus,116,/r/Coronavirus/comments/g0d8ky/uk_government_urged_to_follow_sir_alexander/,co.uk
1,Vaccine could be ready by september,https://7news.com.au/lifestyle/healthmedicine/coronavirus-vaccine-could-be-ready-by-september-c-971014,Coronavirus,9,/r/Coronavirus/comments/g0chex/vaccine_could_be_ready_by_september/,com.au
1,Scientist Kizzmekia Corbett leads the way on COVID-19 vaccine trials with dedication and humor,https://www.nbcnews.com/news/nbcblk/scientist-kizzmekia-corbett-leads-way-covid-19-vaccine-trials-dedication-n1181626,Coronavirus,40,/r/Coronavirus/comments/g09cdx/scientist_kizzmekia_corbett_leads_the_way_on/,nbcnews.com
1,"Help scientists design vaccine candidates for COVID-19 with the game Foldit. Players fold protein structures to achieve a high score. The most promising solutions will be manufactured and tested at the University of Washington Institute for Protein Design in Seattle. Played before, was quite fun.",https://fold.it/portal/,Coronavirus,24,/r/Coronavirus/comments/g04nnf/help_scientists_design_vaccine_candidates_for/,fold.it
1,How Close Are We To A COVID-19 Vaccine?,https://fivethirtyeight.com/videos/how-close-are-we-to-a-covid-19-vaccine/,Coronavirus,17,/r/Coronavirus/comments/g01tot/how_close_are_we_to_a_covid19_vaccine/,fivethirtyeight.com
1,"COVID-19: Therapy, Vaccine Show Promising Breakthrough in Israel",https://www.natureworldnews.com/articles/43642/20200411/covid-19-therapy-vaccine-israel-pluristems-placenta-based-cell-therapy-migal.htm,Coronavirus,16,/r/Coronavirus/comments/g01pfz/covid19_therapy_vaccine_show_promising/,natureworldnews.com
1,"WHO official warns coronavirus may ""stalk the human race"" until there's a vaccine",https://www.axios.com/who-david-nabarro-coronavirus-4883bca0-127a-4c1a-82c1-79614c221083.html,Coronavirus,6,/r/Coronavirus/comments/fzz4cr/who_official_warns_coronavirus_may_stalk_the/,axios.com
1,VACCINE IN SEPTEMBER! Coronavirus vaccine could be ready this Autumn. University of Oxford,https://tonic75.com/1935/vaccine-in-september-coronavirus-vaccine-could-be-ready-this-autumn-university-of-oxford/,Coronavirus,6,/r/Coronavirus/comments/fzrla5/vaccine_in_september_coronavirus_vaccine_could_be/,tonic75.com
1,When will we have a coronavirus vaccine?,https://www.theguardian.com/world/2020/apr/12/when-will-we-have-a-coronavirus-vaccine,Coronavirus,11,/r/Coronavirus/comments/fzrboh/when_will_we_have_a_coronavirus_vaccine/,theguardian.com
1,Bill Gates calls for funding from G-20 members to develop vaccine vs coronavirus,https://newsinfo.inquirer.net/1257343/bill-gates-calls-for-funding-from-g-20-members-to-develop-vaccine-vs-coronavirus,Coronavirus,159,/r/Coronavirus/comments/fzqj5c/bill_gates_calls_for_funding_from_g20_members_to/,inquirer.net
1,"Coronavirus vaccine could be ready in September, scientist says",https://www.msn.com/en-in/health/familyhealth/coronavirus-vaccine-could-be-ready-in-september-scientist-says/ar-BB12t6Tk,Coronavirus,25,/r/Coronavirus/comments/fznwow/coronavirus_vaccine_could_be_ready_in_september/,msn.com
1,Top UK scientist: '80 percent' confident a COVID-19 vaccine could be ready by September,https://thehill.com/policy/international/europe/492372-top-uk-scientist-80-percent-confident-a-covid-19-vaccine-could-be,Coronavirus,41,/r/Coronavirus/comments/fzloq6/top_uk_scientist_80_percent_confident_a_covid19/,thehill.com
1,Nature Reviews Drug Discovery: The COVID-19 vaccine development landscape.,https://www.nature.com/articles/d41573-020-00073-5,Coronavirus,21,/r/Coronavirus/comments/fzk3rl/nature_reviews_drug_discovery_the_covid19_vaccine/,nature.com
1,"Dr. Louis Falo talks Southwest Greensburg, Pitt coronavirus vaccine and Dr. Anthony Fauci",https://triblive.com/local/westmoreland/dr-louis-falo-talks-southwest-greensburg-pitt-coronavirus-vaccine-and-dr-anthony-fauci/,Coronavirus,11,/r/Coronavirus/comments/fzjt1o/dr_louis_falo_talks_southwest_greensburg_pitt/,triblive.com
1,Countries with Mandatory Policies to BCG Vaccine Register Fewer Coronavirus Deaths - Novinite.com - Sofia News Agency,https://www.novinite.com/articles/204095/Countries+with+Mandatory+Policies+to+BCG+Vaccine+Register+Fewer+Coronavirus+Deaths,Coronavirus,12,/r/Coronavirus/comments/fzhb2f/countries_with_mandatory_policies_to_bcg_vaccine/,novinite.com
1,29-year-old COVID-19 patient treated with Israel's new ‘passive vaccine’,https://www.jpost.com/HEALTH-SCIENCE/29-year-old-among-first-to-be-treated-with-MDA-passive-vaccine-624353,Coronavirus,36,/r/Coronavirus/comments/fzfr9t/29yearold_covid19_patient_treated_with_israels/,jpost.com
1,Coronavirus vaccine could be ready by September,https://www.thetimes.co.uk/article/coronavirus-vaccine-could-be-ready-by-september-flmwl257x,Coronavirus,59,/r/Coronavirus/comments/fzdcps/coronavirus_vaccine_could_be_ready_by_september/,co.uk
1,Why a coronavirus vaccine could take way longer than a year,https://www.nationalgeographic.com/science/2020/04/why-coronavirus-vaccine-could-take-way-longer-than-a-year/,Coronavirus,69,/r/Coronavirus/comments/fzcr3g/why_a_coronavirus_vaccine_could_take_way_longer/,nationalgeographic.com
1,Canada unlikely to return to normal until there is a COVID-19 vaccine,https://www.pbs.org/newshour/health/canada-unlikely-to-return-to-normal-until-there-is-a-covid-19-vaccine,Coronavirus,7,/r/Coronavirus/comments/fxzwka/canada_unlikely_to_return_to_normal_until_there/,pbs.org
1,Microneedle coronavirus vaccine triggers immune response in mice,https://www.nih.gov/news-events/nih-research-matters/microneedle-coronavirus-vaccine-triggers-immune-response-mice,Coronavirus,6,/r/Coronavirus/comments/fxzq5s/microneedle_coronavirus_vaccine_triggers_immune/,nih.gov
1,Race to find vaccine intensifies as Asia sees 2nd wave of coronavirus infections,https://www.oregonlive.com/coronavirus/2020/04/race-to-find-vaccine-intensifies-as-asia-sees-2nd-wave-of-coronavirus-infections.html,Coronavirus,16,/r/Coronavirus/comments/fxyna6/race_to_find_vaccine_intensifies_as_asia_sees_2nd/,oregonlive.com
1,"Lockdowns shouldn't be fully lifted until coronavirus vaccine found, new study warns",https://www.cnn.com/2020/04/09/world/lockdown-lift-vaccine-coronavirus-lancet-intl/index.html,Coronavirus,5,/r/Coronavirus/comments/fxx22t/lockdowns_shouldnt_be_fully_lifted_until/,cnn.com
1,Nature magazine: The COVID-19 vaccine development landscape,https://www.nature.com/articles/d41573-020-00073-5,Coronavirus,13,/r/Coronavirus/comments/fxwu89/nature_magazine_the_covid19_vaccine_development/,nature.com
1,Recent study on antibodies widely misinterpreted on re-infection and vaccine implications,https://covidpapers.github.io/posts/neutralizing-antibody-responses-to-sars-cov-2-in-a-covid-19-recovered-1-patient-cohort-and-their-implications/?utm_source=social&amp;utm_medium=reddit_share&amp;utm_campaign=posts,Coronavirus,20,/r/Coronavirus/comments/fxwbai/recent_study_on_antibodies_widely_misinterpreted/,github.io
1,"Sanofi CEO Talks Vaccine Development, Potential Treatment",https://m.benzinga.com/article/15768782?utm_referrer=https%3A%2F%2Fwww.benzinga.com%2Fstock%2Fsny&amp;utm_source=https%3A%2F%2Fwww.benzinga.com%2Fstock%2Fsny,Coronavirus,4,/r/Coronavirus/comments/fxw0vu/sanofi_ceo_talks_vaccine_development_potential/,benzinga.com
1,"No return to ‘normality’ until coronavirus vaccine is available, Trudeau says",https://globalnews.ca/news/6799110/coronavirus-covid-19-vaccine-return-to-normality-trudeau/,Coronavirus,21,/r/Coronavirus/comments/fxv82l/no_return_to_normality_until_coronavirus_vaccine/,globalnews.ca
1,"Lockdowns shouldn't be fully lifted until coronavirus vaccine found, new study warns",https://www.erienewsnow.com/story/41990836/lockdowns-shouldnt-be-fully-lifted-until-coronavirus-vaccine-found-new-study-warns,Coronavirus,5,/r/Coronavirus/comments/fxtfo9/lockdowns_shouldnt_be_fully_lifted_until/,erienewsnow.com
1,Africa will not be test ground for vaccine - WHO,https://www.bbc.com/news/world-africa-52192184,Coronavirus,6,/r/Coronavirus/comments/fxn35z/africa_will_not_be_test_ground_for_vaccine_who/,bbc.com
1,Israeli scientists: Coronavirus vaccine to be tested on humans by June 1,https://www.jpost.com/health-science/israeli-scientists-active-component-of-coronavirus-vaccine-days-away-623228,Coronavirus,19,/r/Coronavirus/comments/fxmo30/israeli_scientists_coronavirus_vaccine_to_be/,jpost.com
1,Lockdowns can’t end until Covid-19 vaccine found,https://www.theguardian.com/world/2020/apr/08/lockdowns-cant-end-until-covid-19-vaccine-found-study-says,Coronavirus,45,/r/Coronavirus/comments/fxkzy3/lockdowns_cant_end_until_covid19_vaccine_found/,theguardian.com
1,Does 99-Year Old BCG Vaccine Really Defend from COVID-19?,https://www.labroots.com/trending/drug-discovery-and-development/17271/99-year-bcg-vaccine-defend-covid-19,Coronavirus,4,/r/Coronavirus/comments/fxg3as/does_99year_old_bcg_vaccine_really_defend_from/,labroots.com
1,TB vaccine appears to offer protection against COVID-19,https://www.hindustantimes.com/india-news/tb-vaccine-appears-to-offer-protection-against-covid-19/story-lHholAkFWyOW5HSWI3A4zM.html,Coronavirus,8,/r/Coronavirus/comments/fwmllf/tb_vaccine_appears_to_offer_protection_against/,hindustantimes.com
1,"Israeli scientists: 'In a few weeks, we will have coronavirus vaccine'",https://www.jpost.com/HEALTH-SCIENCE/Israeli-scientists-In-three-weeks-we-will-have-coronavirus-vaccine-619101,Coronavirus,6,/r/Coronavirus/comments/fwmd2k/israeli_scientists_in_a_few_weeks_we_will_have/,jpost.com
1,"A second potential COVID-19 vaccine, backed by Bill and Melinda Gates, is entering human testing",https://techcrunch.com/2020/04/06/a-second-potential-covid-19-vaccine-backed-by-bill-and-melinda-gates-is-entering-human-testing/,Coronavirus,33,/r/Coronavirus/comments/fw7dl2/a_second_potential_covid19_vaccine_backed_by_bill/,techcrunch.com
1,Flu Vaccine Increases Coronavirus Risk 36% Says Military Study,https://www.disabledveterans.org/2020/03/11/flu-vaccine-increases-coronavirus-risk/,Coronavirus,4,/r/Coronavirus/comments/fw5ihd/flu_vaccine_increases_coronavirus_risk_36_says/,disabledveterans.org
1,WHO says coronavirus vaccine and treatment research has ‘accelerated at incredible speed’,https://www.cnbc.com/2020/04/06/who-says-coronavirus-vaccine-and-treatment-research-has-accelerated-at-incredible-speed.html,Coronavirus,27,/r/Coronavirus/comments/fw55v0/who_says_coronavirus_vaccine_and_treatment/,cnbc.com
1,Africa will not be test ground for vaccine - WHO,https://www.bbc.com/news/world-africa-52192184,Coronavirus,8,/r/Coronavirus/comments/fw4x5p/africa_will_not_be_test_ground_for_vaccine_who/,bbc.com
1,"Hulk Hogan on coronavirus: ‘Maybe we don’t need a vaccine’ | On Instagram, Hogan said social distancing could offer a religious “personal revival” for a world that needs it.",https://www.tampabay.com/news/health/2020/04/06/hulk-hogan-on-coronavirus-maybe-we-dont-need-a-vaccine/,Coronavirus,5,/r/Coronavirus/comments/fw41gn/hulk_hogan_on_coronavirus_maybe_we_dont_need_a/,tampabay.com
1,Bill Gates says he’ll spend billions on coronavirus vaccine development,https://www.marketwatch.com/story/bill-gates-says-hell-spend-billions-on-coronavirus-vaccine-development-2020-04-06,Coronavirus,54,/r/Coronavirus/comments/fw20mo/bill_gates_says_hell_spend_billions_on/,marketwatch.com
1,Bill Gates: 'Things won’t go back to truly normal until we have a vaccine’,https://www.inquisitr.com/5983108/bill-gates-coronavirus-back-to-normal-vaccine/,Coronavirus,120,/r/Coronavirus/comments/fvoffg/bill_gates_things_wont_go_back_to_truly_normal/,inquisitr.com
1,University of Pittsburgh reports successful COVID-19 vaccine trial,https://www.dailyitem.com/coronavirus/university-of-pittsburgh-reports-successful-covid-19-vaccine-trial/article_ce2ace4d-f4ba-5037-97d3-07dadff72a34.html?fbclid=IwAR2SDhYQRX7CroU3_PzOz8S0epSckDxNPn8Sirw-kzrQg049cZl0FNbuYkM#utm_campaign=blox&amp;utm_source=facebook&amp;utm_medium=social,Coronavirus,7,/r/Coronavirus/comments/fvo3fi/university_of_pittsburgh_reports_successful/,dailyitem.com
1,"Usa, the first vaccine that has passed animal tests. It also ""speaks"" Italian: ""It will be a plaster with 400 small needles""",https://www.corriere.it/video-articoli/2020/04/03/usa-primo-vaccino-che-ha-superato-test-animali-parla-anche-italiano-sara-cerotto/326bd0f0-7580-11ea-856e-f9aa62c97d7a.shtml,Coronavirus,12,/r/Coronavirus/comments/fvkula/usa_the_first_vaccine_that_has_passed_animal/,corriere.it
1,COVID-19: Could TB vaccine offer protection?,https://www.medicalnewstoday.com/articles/covid-19-could-tb-vaccine-offer-protection,Coronavirus,6,/r/Coronavirus/comments/fvki5p/covid19_could_tb_vaccine_offer_protection/,medicalnewstoday.com
1,"Scott Gottlieb discusses coronavirus on ""Face the Nation"": “Things are going to be permanently changed...until we get to a vaccine and we can fully vanquish this”",https://www.cbsnews.com/news/transcript-scott-gottlieb-discusses-coronavirus-on-face-the-nation-april-5-2020/?ftag=CNM-00-10aab7b&amp;linkId=85872972,Coronavirus,49,/r/Coronavirus/comments/fvk8fq/scott_gottlieb_discusses_coronavirus_on_face_the/,cbsnews.com
1,Tuberculosis vaccine ‘potential game-changer’ in Covid-19 fight,https://www.irishtimes.com/news/health/tuberculosis-vaccine-potential-game-changer-in-covid-19-fight-1.4220383?mode=amp,Coronavirus,14,/r/Coronavirus/comments/fvikf1/tuberculosis_vaccine_potential_gamechanger_in/,irishtimes.com
1,Infect volunteers to speed a coronavirus vaccine?,https://science.sciencemag.org/content/368/6486/16,Coronavirus,12,/r/Coronavirus/comments/fvigqu/infect_volunteers_to_speed_a_coronavirus_vaccine/,sciencemag.org
1,Not guinea pigs': Africa vaccine trial suggestion sparks uproar,https://www.france24.com/en/20200403-not-guinea-pigs-africa-vaccine-trial-suggestion-sparks-uproar,Coronavirus,33,/r/Coronavirus/comments/fv0is2/not_guinea_pigs_africa_vaccine_trial_suggestion/,france24.com
1,"Wetangu'la rejects COVID-19 vaccine test in Africa: ""We aren't Guinea pigs""",https://www.tuko.co.ke/349783-resist-senator-wetangula-calls-african-leaders-reject-covid-19-vaccine-test-continent.html?utm_source=facebook&amp;utm_medium=ps&amp;fbclid=IwAR2w6O3gwG_ENK4skrhL-W-_Q8hYBTk9FmxmoNb7Diald8l2g-dz50M10wo,Coronavirus,55,/r/Coronavirus/comments/fv0g3r/wetangula_rejects_covid19_vaccine_test_in_africa/,co.ke
1,Initial research in mice of a novel COVID19 vaccine injected by a fingertipsized patch have shown that it can induce an immune response against the novel COVID19 at such levels that it might prevent infection .,https://thenewsspan.in/vaccine-created-in-us-works-on-mice/,Coronavirus,85,/r/Coronavirus/comments/fv08bn/initial_research_in_mice_of_a_novel_covid19/,thenewsspan.in
1,"Without a coronavirus vaccine, America can’t even think about bringing sports back",https://www.nydailynews.com/sports/football/ny-sports-coronavirus-return-2021-20200404-nlb3t3u6hreyrd4kfwaqbepaoe-story.html,Coronavirus,66,/r/Coronavirus/comments/fuzwwo/without_a_coronavirus_vaccine_america_cant_even/,nydailynews.com
1,"Big Tobacco Announces ""Breakthrough"" in Plant-Based Coronavirus Vaccine",https://www.freethink.com/articles/plant-based-coronavirus-vaccine,Coronavirus,4,/r/Coronavirus/comments/fuyqhw/big_tobacco_announces_breakthrough_in_plantbased/,freethink.com
