class,title,url,subreddit,score,permalink,Source
1,Human trials of second Russian COVID-19 vaccine to start July 27,https://news.trust.org/item/20200724145727-iugsd/,Coronavirus,11,/r/Coronavirus/comments/hx462m/human_trials_of_second_russian_covid19_vaccine_to/,trust.org
1,China's Sinopharm says coronavirus vaccine could be ready for the public use by year-end: state media - Reuters,https://www.reuters.com/article/us-health-coronavirus-vaccine-china/chinas-sinopharm-says-coronavirus-vaccine-could-be-ready-by-year-end-state-media-idUSKCN24O0PM,Coronavirus,29,/r/Coronavirus/comments/hx0rcz/chinas_sinopharm_says_coronavirus_vaccine_could/,reuters.com
1,"Without A Vaccine, Researchers Say, Herd Immunity May Never Be Achieved",https://www.npr.org/sections/health-shots/2020/07/24/894148860/without-a-vaccine-researchers-say-herd-immunity-may-never-be-achieved,Coronavirus,28,/r/Coronavirus/comments/hwz3fb/without_a_vaccine_researchers_say_herd_immunity/,npr.org
1,Moderna loses challenge to Arbutus patent on vaccine technology,https://uk.reuters.com/article/us-moderna-patent/moderna-loses-challenge-to-arbutus-patent-on-vaccine-technology-idUKKCN24O2XY,Coronavirus,6,/r/Coronavirus/comments/hwqjlt/moderna_loses_challenge_to_arbutus_patent_on/,reuters.com
1,Meet the 4 frontrunners in the COVID-19 vaccine race,https://arstechnica.com/science/2020/07/meet-the-4-frontrunners-in-the-covid-19-vaccine-race/,Coronavirus,9,/r/Coronavirus/comments/hwq0r0/meet_the_4_frontrunners_in_the_covid19_vaccine/,arstechnica.com
1,Bill Gates confirms he won't use a COVID-19 vaccine to microchip people,https://www.sbs.com.au/news/bill-gates-confirms-he-won-t-use-a-covid-19-vaccine-to-microchip-people,Coronavirus,1083,/r/Coronavirus/comments/hwnv4q/bill_gates_confirms_he_wont_use_a_covid19_vaccine/,com.au
1,Mexico says China plans $1 billion loan to ease Latin access to virus vaccine,https://www.reuters.com/article/us-health-coronavirus-mexico-china/mexico-says-china-plans-1-billion-loan-to-ease-latam-access-to-virus-vaccine-idUSKCN24O08L,Coronavirus,75,/r/Coronavirus/comments/hwme3u/mexico_says_china_plans_1_billion_loan_to_ease/,reuters.com
1,Bill Gates shot down a conspiracy theory that he wants a global coronavirus vaccine rollout so he can implant microchips into people,https://www.msn.com/en-us/health/medical/bill-gates-shot-down-a-conspiracy-theory-that-he-wants-a-global-coronavirus-vaccine-rollout-so-he-can-implant-microchips-into-people/ar-BB1762Yf,Coronavirus,9,/r/Coronavirus/comments/hwk42f/bill_gates_shot_down_a_conspiracy_theory_that_he/,msn.com
1,China Says It Will Have Covid-19 Vaccine Ready This Year,https://www.wsj.com/articles/china-says-it-will-have-covid-19-vaccine-ready-this-year-11595521469,Coronavirus,48,/r/Coronavirus/comments/hwitsc/china_says_it_will_have_covid19_vaccine_ready/,wsj.com
1,You Can Now Sign Up For COVID-19 Vaccine Trials In South Florida,https://www.narcity.com/news/us/fl/miami/covid19-vaccine-trial-in-south-florida-is-looking-for-participants,Coronavirus,29,/r/Coronavirus/comments/hwfsvp/you_can_now_sign_up_for_covid19_vaccine_trials_in/,narcity.com
1,Tokyo Olympics might not happen next summer without coronavirus vaccine,https://www.latimes.com/sports/story/2020-07-22/coronavirus-vaccine-key-tokyo-olympics-official-says,Coronavirus,26,/r/Coronavirus/comments/hwfbvj/tokyo_olympics_might_not_happen_next_summer/,latimes.com
1,U.S. sets global benchmark for COVID-19 vaccine price at around the cost of a flu shot,https://www.reuters.com/article/us-health-coronavirus-vaccine-pricing-an/u-s-sets-global-benchmark-for-covid-19-vaccine-price-at-around-the-cost-of-a-flu-shot-idUSKCN24O1DA,Coronavirus,48,/r/Coronavirus/comments/hwdzkc/us_sets_global_benchmark_for_covid19_vaccine/,reuters.com
1,Pfizer announces $1.95 billion deal to produce 100 million doses of coronavirus vaccine by year-end.,https://www.firstpost.com/world/pfizer-announces-1-95-billion-deal-to-produce-100-million-doses-of-coronavirus-vaccine-by-year-end-8631411.html,Coronavirus,29,/r/Coronavirus/comments/hwctrh/pfizer_announces_195_billion_deal_to_produce_100/,firstpost.com
1,What trial results reveal about the coronavirus vaccine frontrunners,https://www.nature.com/articles/d41586-020-02174-y?,Coronavirus,22,/r/Coronavirus/comments/hwaua5/what_trial_results_reveal_about_the_coronavirus/,nature.com
1,The U.S. Commits to Buying Millions of Vaccine Doses. Why That’s Unusual.,https://www.nytimes.com/2020/07/22/upshot/vaccine-coronavirus-government-purchase.html,Coronavirus,7,/r/Coronavirus/comments/hwad4t/the_us_commits_to_buying_millions_of_vaccine/,nytimes.com
1,"Multiple vaccine doses could be necessary to protect from coronavirus, Bill Gates says",https://www.cbsnews.com/news/bill-gates-coronavirus-vaccine-multiple-doses/,Coronavirus,50,/r/Coronavirus/comments/hwa827/multiple_vaccine_doses_could_be_necessary_to/,cbsnews.com
1,"SinoPharm said its COVID19 vaccine could be on the market by the end of 2020, after the company was approved in late June to begin int'l phase III clinical trials.",https://www.globaltimes.cn/content/1195382.shtml,Coronavirus,109,/r/Coronavirus/comments/hw9nm4/sinopharm_said_its_covid19_vaccine_could_be_on/,globaltimes.cn
1,Taiwan to budget NT$18.7b for COVID-19 vaccine,https://focustaiwan.tw/society/202007220029,Coronavirus,16,/r/Coronavirus/comments/hw8k5b/taiwan_to_budget_nt187b_for_covid19_vaccine/,focustaiwan.tw
1,"When a coronavirus vaccine gets approved, huge hurdles remain for distribution",https://www.msn.com/en-us/health/medical/when-a-coronavirus-vaccine-gets-approved-huge-hurdles-remain-for-distribution/ar-BB174pcB?li=BBnb7Kz,Coronavirus,36,/r/Coronavirus/comments/hw7f5f/when_a_coronavirus_vaccine_gets_approved_huge/,msn.com
1,Coronavirus pandemic | Russia’s elite given experimental COVID-19 vaccine shots since April: Report,https://www.msn.com/en-in/news/other/coronavirus-pandemic-russia-e2-80-99s-elite-given-experimental-covid-19-vaccine-shots-since-april-report/ar-BB1728Q6,Coronavirus,13,/r/Coronavirus/comments/hw42qw/coronavirus_pandemic_russias_elite_given/,msn.com
1,US cuts $1.95 billion deal with Pfizer for 100 million doses of COVID-19 vaccine,https://www.usatoday.com/story/news/health/2020/07/22/us-pays-1-95-billion-100-million-doses-pfizer-covid-19-vaccine/5489964002/,Coronavirus,12,/r/Coronavirus/comments/hw37ik/us_cuts_195_billion_deal_with_pfizer_for_100/,usatoday.com
1,"US secures 100 million doses of Pfizer, BioNTech experimental coronavirus vaccine",https://www.q13fox.com/news/us-secures-100-million-doses-of-pfizer-biontech-experimental-coronavirus-vaccine,Coronavirus,9,/r/Coronavirus/comments/hw1q11/us_secures_100_million_doses_of_pfizer_biontech/,q13fox.com
1,Pfizer Gets $1.95 Billion to Produce Coronavirus Vaccine by Year’s End,https://www.nytimes.com/2020/07/22/us/politics/pfizer-coronavirus-vaccine.html,Coronavirus,13,/r/Coronavirus/comments/hw0yxl/pfizer_gets_195_billion_to_produce_coronavirus/,nytimes.com
1,Novavax executives could get big payday even if vaccine fails - Reuters - Jul 22 2020,https://www.reuters.com/article/us-health-coronavirus-novavax-compensati-idUSKCN24N1G1,Coronavirus,13,/r/Coronavirus/comments/hw0rdl/novavax_executives_could_get_big_payday_even_if/,reuters.com
1,"U.S. to pay Pfizer, BioNTech $1.95 billion for 100 million COVID-19 vaccine doses",https://www.reuters.com/article/us-health-coronavirus-usa-pfizer-idUSKCN24N1I9?utm_campaign=trueAnthem%3A+Trending+Content&amp;utm_medium=trueAnthem&amp;utm_source=facebook,Coronavirus,19,/r/Coronavirus/comments/hvx7he/us_to_pay_pfizer_biontech_195_billion_for_100/,reuters.com
1,Pfizer hopes for October vaccine OK as US orders 100M doses,https://www.usatoday.com/story/news/2020/07/22/coronavirus-covid-19-and-vaccines-trump-masks-and-ex-cdc-director/5484636002/,Coronavirus,66,/r/Coronavirus/comments/hvvgq0/pfizer_hopes_for_october_vaccine_ok_as_us_orders/,usatoday.com
1,Human trials of Chinese-made vaccine begin in Brazil,https://www.youtube.com/watch?v=943fu0AvOpw,Coronavirus,20,/r/Coronavirus/comments/hvv2cn/human_trials_of_chinesemade_vaccine_begin_in/,youtube.com
1,"U.S. government secures 100 million doses of Pfizer, BioNTech vaccine for $2 billion",https://fortune.com/2020/07/22/pfizer-biontech-coronavirus-vaccine-purchase/,Coronavirus,21,/r/Coronavirus/comments/hvuolu/us_government_secures_100_million_doses_of_pfizer/,fortune.com
1,Coronavirus: What I learnt in Oxford’s vaccine trial - BBC - 22 Jul 2020,https://www.bbc.com/future/article/20200721-coronavirus-vaccine-trial-what-its-like-to-participate,Coronavirus,8,/r/Coronavirus/comments/hvun4s/coronavirus_what_i_learnt_in_oxfords_vaccine/,bbc.com
1,Vaccine may determine fate of Tokyo Olympics,https://www.tsn.ca/mori-vaccine-may-determine-fate-of-tokyo-olympics-1.1498328,Coronavirus,23,/r/Coronavirus/comments/hvuif6/vaccine_may_determine_fate_of_tokyo_olympics/,tsn.ca
1,Coronavirus Live Updates: Pfizer Gets $1.95 Billion to Produce Vaccine by Year’s End,https://www.nytimes.com/2020/07/22/world/coronavirus-covid-19.html,Coronavirus,13,/r/Coronavirus/comments/hvugov/coronavirus_live_updates_pfizer_gets_195_billion/,nytimes.com
1,The U.S. enters a pact with Pfizer for 100 million doses of a COVID-19 vaccine which Americans will receive for free,https://www.bloomberg.com/news/articles/2020-07-22/pfizer-biontech-receive-u-s-order-for-covid-vaccine?utm_campaign=socialflow-organic&amp;utm_medium=social&amp;utm_content=business&amp;utm_source=twitter&amp;cmpid=socialflow-twitter-business,Coronavirus,2409,/r/Coronavirus/comments/hvtqja/the_us_enters_a_pact_with_pfizer_for_100_million/,bloomberg.com
1,Pfizer signs deal with U.S. for 100 million coronavirus vaccine doses,https://www.theglobeandmail.com/business/international-business/us-business/article-pfizer-has-signed-deal-with-us-for-100-million-coronavirus-vaccine/,Coronavirus,9,/r/Coronavirus/comments/hvt4ju/pfizer_signs_deal_with_us_for_100_million/,theglobeandmail.com
1,U.S. agrees to pay Pfizer and BioNTech $2 billion for 100 million doses of coronavirus vaccine,https://www.cnbc.com/2020/07/22/us-government-taps-pfizer-to-produce-millions-of-doses-of-coronavirus-vaccine.html,Coronavirus,47,/r/Coronavirus/comments/hvstsx/us_agrees_to_pay_pfizer_and_biontech_2_billion/,cnbc.com
1,"Pfizer, BioNTech Get $1.95 Billion Covid-19 Vaccine Order From U.S. Government - Americans would receive the vaccine for free under agreement with government",https://www.wsj.com/articles/pfizer-biontech-get-1-95-billion-covid-19-vaccine-order-from-u-s-government-11595418221,Coronavirus,337,/r/Coronavirus/comments/hvsdux/pfizer_biontech_get_195_billion_covid19_vaccine/,wsj.com
1,U.S. to pay Pfizer $1.95 billion to produce millions of doses of COVID-19 vaccine,https://www.reuters.com/article/us-health-coronavirus-usa-pfizer/u-s-government-engages-pfizer-to-produce-millions-of-doses-of-covid-19-vaccine-idUSKCN24N1I9,Coronavirus,38,/r/Coronavirus/comments/hvsciw/us_to_pay_pfizer_195_billion_to_produce_millions/,reuters.com
1,Pfizer in Pact with U.S. for 100 Million Covid-19 Vaccine Doses,https://www.bloomberg.com/news/articles/2020-07-22/pfizer-in-pact-with-u-s-for-100-million-covid-19-vaccine-doses-kcx9x3ww?utm_source=facebook&amp;utm_medium=social&amp;utm_content=business&amp;cmpid=socialflow-facebook-business&amp;utm_campaign=socialflow-organic,Coronavirus,19,/r/Coronavirus/comments/hvs4eu/pfizer_in_pact_with_us_for_100_million_covid19/,bloomberg.com
1,U.S. government taps Pfizer to produce millions of doses of coronavirus vaccine,https://www.cnbc.com/2020/07/22/us-government-taps-pfizer-to-produce-millions-of-doses-of-coronavirus-vaccine.html?__source=androidappshare,Coronavirus,12,/r/Coronavirus/comments/hvs1gq/us_government_taps_pfizer_to_produce_millions_of/,cnbc.com
0,US orders China to close Houston consulate 'to protect American intellectual property'，Says Chinese Hackers Stole Coronavirus Vaccine Development Data,https://www.khou.com/article/news/local/chinese-consulate-houston-eviction-notice-fire-reported/285-b9902c83-09af-4bc3-92e0-9b98d0f4065c,Coronavirus,102,/r/Coronavirus/comments/hvrgdd/us_orders_china_to_close_houston_consulate_to/,khou.com
0,US indicts Chinese hackers for alleged bid to steal COVID vaccine research,https://www.gmanetwork.com/news/news/world/747905/us-indicts-chinese-hackers-for-alleged-bid-to-steal-covid-vaccine-research/,Coronavirus,37,/r/Coronavirus/comments/hvqppw/us_indicts_chinese_hackers_for_alleged_bid_to/,gmanetwork.com
1,Taiwan announces 18.7 billion NTD (USD ~$635 mill) in financial support to domestic vaccine manufacturers for COVID-19 development,https://translate.google.com/translate?sl=zh-CN&amp;tl=en&amp;u=https%3A%2F%2Fhealth.ltn.com.tw%2Farticle%2Fbreakingnews%2F3236338,Coronavirus,40,/r/Coronavirus/comments/hvqh16/taiwan_announces_187_billion_ntd_usd_635_mill_in/,google.com
1,"Charles Darwin, macaques and the vaccine",https://newest-websites.com/charles-darwin-macaques-and-the-vaccine/,Coronavirus,12,/r/Coronavirus/comments/hvouit/charles_darwin_macaques_and_the_vaccine/,newest-websites.com
1,North Korea claims to have no coronavirus cases but is working on a vaccine anyway,https://qz.com/1882821/north-korea-is-working-on-a-covid-vaccine-while-claiming-no-cases/,Coronavirus,134,/r/Coronavirus/comments/hvojyu/north_korea_claims_to_have_no_coronavirus_cases/,qz.com
1,"Rapid decay of Anti–SARS-CoV-2 antibodies in people with mild Covid-19 raises concern that immunity may not be long lasting in those with mild illness, who compose the majority of infections, finds new study in NEJM (21 July 2020), with implications for herd immunity and vaccine effectiveness.",https://www.nejm.org/doi/full/10.1056/NEJMc2025179,Coronavirus,34,/r/Coronavirus/comments/hvjs1w/rapid_decay_of_antisarscov2_antibodies_in_people/,nejm.org
1,Chinese COVID-19 vaccine starts final tests in Brazil,https://www.france24.com/en/20200721-chinese-covid-19-vaccine-starts-final-tests-in-brazil,Coronavirus,101,/r/Coronavirus/comments/hvj8yn/chinese_covid19_vaccine_starts_final_tests_in/,france24.com
1,"Some Vaccine Makers Say They Plan to Profit From Coronavirus Vaccine: Moderna, which is receiving $483 million from the U.S. government, told lawmakers it would not sell its vaccine at cost. Pfizer has said it would also profit, but has so far taken no government money.",https://www.nytimes.com/2020/07/21/health/covid-19-vaccine-coronavirus-moderna-pfizer.html?campaign_id=57&amp;emc=edit_ne_20200721&amp;instance_id=20503&amp;nl=evening-briefing&amp;regi_id=68337520&amp;segment_id=34002&amp;te=1&amp;user_id=b6e55f6f6979146395b2946f4fb0e01e,Coronavirus,166,/r/Coronavirus/comments/hvhs4o/some_vaccine_makers_say_they_plan_to_profit_from/,nytimes.com
1,"If the Oxford vaccine ends up working, I'm planning on sending the research team a bottle of Havana Club. Can we all pitch in to smother them with presents and cards?",https://www.ox.ac.uk/contact-us,Coronavirus,6,/r/Coronavirus/comments/hvg18y/if_the_oxford_vaccine_ends_up_working_im_planning/,ac.uk
0,US Charges Chinese Hackers Over COVID-19 Vaccine Cyberattacks,https://www.cnet.com/news/us-charges-chinese-hackers-over-covid-19-vaccine-cyberattacks/,Coronavirus,13,/r/Coronavirus/comments/hvfht0/us_charges_chinese_hackers_over_covid19_vaccine/,cnet.com
1,Chinese Vaccine against Covid-19 Arrives in Brazil and Tests Start on Tuesday,https://www1.folha.uol.com.br/internacional/en/scienceandhealth/2020/07/chinese-vaccine-against-covid-19-arrives-in-brazil-and-tests-start-on-tuesday.shtml?utm_source=newsletter&amp;utm_medium=email&amp;utm_campaign=newsen,Coronavirus,50,/r/Coronavirus/comments/hvervb/chinese_vaccine_against_covid19_arrives_in_brazil/,com.br
1,AstraZeneca leaning towards two dose strategy for COVID-19 vaccine - executive,https://uk.reuters.com/article/us-health-coronavirus-oxford-vaccine-idUKKCN24L1ZK,Coronavirus,205,/r/Coronavirus/comments/hvdyxs/astrazeneca_leaning_towards_two_dose_strategy_for/,reuters.com
1,"Possible coronavirus vaccine unlikely to be made widely available before 2021, UK vaccine head says",https://edition.cnn.com/world/live-news/coronavirus-pandemic-07-21-20-intl/h_25929cdfe1d7857f3f146aa77cd23ab1,Coronavirus,42,/r/Coronavirus/comments/hvdvbk/possible_coronavirus_vaccine_unlikely_to_be_made/,cnn.com
1,Serum Institute of India to produce 1 bn doses of Oxford-AstraZeneca COVID-19 vaccine,https://www.indiatvnews.com/business/news-covid-19-vaccine-serum-institute-of-india-1-billion-dozes-oxford-astrazeneca-635631,Coronavirus,337,/r/Coronavirus/comments/hvd0wg/serum_institute_of_india_to_produce_1_bn_doses_of/,indiatvnews.com
1,U.S. Indicts Chinese Hackers for Stealing Coronavirus Vaccine Research,https://www.digitaltrends.com/news/chinese-hackers-indicted-in-stealing-cornavirus-vaccine-research/,Coronavirus,10,/r/Coronavirus/comments/hvbsst/us_indicts_chinese_hackers_for_stealing/,digitaltrends.com
1,Here’s when experts say Oxford University’s coronavirus vaccine could be ready,https://globalnews.ca/news/7198108/coronavirus-oxford-vaccine-trials/,Coronavirus,8,/r/Coronavirus/comments/hvbrv6/heres_when_experts_say_oxford_universitys/,globalnews.ca
0,"U.S. charges two Chinese nationals over coronavirus vaccine hacking scheme, other crimes",https://www.cnbc.com/2020/07/21/us-charges-chinese-nationals-for-coronavirus-vaccine-hacking-scheme-other-crimes.html,Coronavirus,16,/r/Coronavirus/comments/hv9wys/us_charges_two_chinese_nationals_over_coronavirus/,cnbc.com
0,U.S accuses China of sponsoring criminal hackers targeting covid-19 vaccine research,https://www.washingtonpost.com/national-security/us-china-covid-19-vaccine-research/2020/07/21/8b6ca0c0-cb58-11ea-91f1-28aca4d833a0_story.html,Coronavirus,28,/r/Coronavirus/comments/hv9u98/us_accuses_china_of_sponsoring_criminal_hackers/,washingtonpost.com
1,Russia’s business and political elite have been given early access to an experimental vaccine against COVID-19,https://time.com/5868980/coronavirus-vaccine-russian-elite/,Coronavirus,28,/r/Coronavirus/comments/hv9ncw/russias_business_and_political_elite_have_been/,time.com
1,Oxford COVID-19 vaccine developer cautious on 2020 roll-out,https://www.reuters.com/article/us-health-coronavirus-oxford-vaccine-gil/oxford-covid-19-vaccine-developer-cautious-on-2020-roll-out-idUSKCN24M0OP?il=0,Coronavirus,13,/r/Coronavirus/comments/hv9kom/oxford_covid19_vaccine_developer_cautious_on_2020/,reuters.com
1,[Podcast] The Vaccine Trust Problem,https://www.nytimes.com/2020/07/21/podcasts/the-daily/coronavirus-vaccine.html,Coronavirus,4,/r/Coronavirus/comments/hv8c6g/podcast_the_vaccine_trust_problem/,nytimes.com
1,"Low Chance of Vaccine This Year, Johnson’s Medical Adviser Says",https://www.bloomberg.com/news/articles/2020-07-21/low-chance-of-vaccine-this-year-johnson-s-medical-adviser-says?srnd=coronavirus,Coronavirus,9,/r/Coronavirus/comments/hv86jr/low_chance_of_vaccine_this_year_johnsons_medical/,bloomberg.com
1,Possible but not certain COVID-19 vaccine rolled out this year: Oxford developer,https://www.reuters.com/article/us-health-coronavirus-oxford-vaccine-gil-idUSKCN24M0OP,Coronavirus,696,/r/Coronavirus/comments/hv5zof/possible_but_not_certain_covid19_vaccine_rolled/,reuters.com
1,"Coronavirus vaccine likely by end of 2020 or early next year, says AIIMS director: Key points, Health News, ET HealthWorld",https://health.economictimes.indiatimes.com/news/diagnostics/coronavirus-vaccine-likely-by-end-of-2020-or-early-next-year-says-aiims-director-key-points/77077338,Coronavirus,45,/r/Coronavirus/comments/hv5whg/coronavirus_vaccine_likely_by_end_of_2020_or/,indiatimes.com
1,Researchers Publish Encouraging Early Data on COVID-19 Vaccine,https://directorsblog.nih.gov/2020/07/16/researchers-publish-encouraging-early-data-on-covid-19-vaccine/,Coronavirus,10,/r/Coronavirus/comments/hv4i0n/researchers_publish_encouraging_early_data_on/,nih.gov
1,Brazil set to test Chinese coronavirus vaccine,https://www.msn.com/en-us/news/world/brazil-set-to-test-chinese-coronavirus-vaccine/ar-BB16Za6z,Coronavirus,24,/r/Coronavirus/comments/hv3cow/brazil_set_to_test_chinese_coronavirus_vaccine/,msn.com
1,Researcher searching for North Texans to participate in breakthrough COVID-19 vaccine trials: 'This is the first big step',http://rssfeeds.wfaa.com/~/631005177/0/wfaa/local~Researcher-searching-for-North-Texans-to-participate-in-breakthrough-COVID-vaccine-trials-This-is-the-first-big-step,Coronavirus,25,/r/Coronavirus/comments/hv052o/researcher_searching_for_north_texans_to/,wfaa.com
1,"Oxford’s Covid-19 vaccine candidate is safe, early results show - world news - Hindustan Times",https://m.hindustantimes.com/world-news/oxford-s-covid-19-vaccine-candidate-s-initial-results-show-it-is-safe/story-SO1USJvXyCi3hVWp0h4g4L.html,Coronavirus,19,/r/Coronavirus/comments/huzevg/oxfords_covid19_vaccine_candidate_is_safe_early/,hindustantimes.com
1,"Oxford coronavirus vaccine is safe and triggers strong immune response, human trials show",https://www.sbs.com.au/news/oxford-coronavirus-vaccine-is-safe-and-triggers-strong-immune-response-human-trials-show?cid=newsapp:socialshare:copylink,Coronavirus,183,/r/Coronavirus/comments/huy0b6/oxford_coronavirus_vaccine_is_safe_and_triggers/,com.au
1,House GOP leader to introduce bill that would sanction virus vaccine hackers,https://www.axios.com/mccarthy-sanction-coronavirus-vaccine-hackers-9ff12119-00a2-4ee7-b4ad-5c75e7dc1b78.html,Coronavirus,17,/r/Coronavirus/comments/huvim9/house_gop_leader_to_introduce_bill_that_would/,axios.com
1,New Data on the CanSino Vaccine,https://blogs.sciencemag.org/pipeline/archives/2020/07/20/new-data-on-the-cansino-vaccine,Coronavirus,14,/r/Coronavirus/comments/huuybi/new_data_on_the_cansino_vaccine/,sciencemag.org
1,Everything you need to know about the Oxford COVID-19 vaccine,http://news.sky.com/story/coronavirus-everything-you-need-to-know-about-the-oxford-covid-19-vaccine-12032848,Coronavirus,31,/r/Coronavirus/comments/huuqh0/everything_you_need_to_know_about_the_oxford/,sky.com
1,"Safety and immunogenicity of the ChAdOx1 nCoV-19 vaccine against SARS-CoV-2: a preliminary report of a phase 1/2, single-blind, randomised [non-placebo] controlled trial",https://www.thelancet.com/action/showPdf?pii=S0140-6736%2820%2931604-4,Coronavirus,7,/r/Coronavirus/comments/huuavb/safety_and_immunogenicity_of_the_chadox1_ncov19/,thelancet.com
1,Double-Shot Covid Vaccine Tests Raise New Pandemic Challenge,https://www.bloomberg.com/news/articles/2020-07-20/double-shot-covid-vaccine-tests-raise-new-pandemic-challenge,Coronavirus,8,/r/Coronavirus/comments/huu364/doubleshot_covid_vaccine_tests_raise_new_pandemic/,bloomberg.com
1,New Data on the Oxford/AZ Vaccine,https://blogs.sciencemag.org/pipeline/archives/2020/07/20/new-data-on-the-oxford-az-vaccine,Coronavirus,17,/r/Coronavirus/comments/hutlh5/new_data_on_the_oxfordaz_vaccine/,sciencemag.org
1,Pfizer-BioNTech potential COVID-19 vaccine shows promise in additional data,https://in.reuters.com/article/health-coronavirus-pfizer-biontech/pfizer-biontech-potential-covid-19-vaccine-shows-promise-in-additional-data-idINKCN24L1L3?il=0,Coronavirus,192,/r/Coronavirus/comments/hurt4g/pfizerbiontech_potential_covid19_vaccine_shows/,reuters.com
1,CanSino coronavirus vaccine shows immune response in human trial,https://in.reuters.com/article/us-health-coronavirus-cansinobio/cansino-coronavirus-vaccine-shows-immune-response-in-human-trial-idINKCN24L1NP,Coronavirus,130,/r/Coronavirus/comments/hurryz/cansino_coronavirus_vaccine_shows_immune_response/,reuters.com
1,Oxford's COVID-19 vaccine is starting to look like a winner,https://thenextweb.com/corona/2020/07/20/oxfords-covid-19-vaccine-is-starting-to-look-like-a-winner/,Coronavirus,181,/r/Coronavirus/comments/hur6p8/oxfords_covid19_vaccine_is_starting_to_look_like/,thenextweb.com
1,"Oxford Vaccine Partner Plans Trials In India, Manufacturing Soon",https://www.ndtv.com/india-news/need-permission-to-test-oxford-coronavirus-vaccine-in-india-firm-partnering-oxford-2266024,Coronavirus,118,/r/Coronavirus/comments/huqi3g/oxford_vaccine_partner_plans_trials_in_india/,ndtv.com
1,Potential Oxford Coronavirus Vaccine Prompts Strong Immune Response in Early Trial,https://www.usnews.com/news/health-news/articles/2020-07-20/oxford-coronavirus-vaccine-prompts-strong-immune-response-in-early-trial,Coronavirus,4,/r/Coronavirus/comments/huq5e2/potential_oxford_coronavirus_vaccine_prompts/,usnews.com
1,"Vaccine Tracker - CBC - July 22, 2020",https://www.cbc.ca/vaccinetracker/,Coronavirus,7,/r/Coronavirus/comments/hupw23/vaccine_tracker_cbc_july_22_2020/,cbc.ca
1,Members of Russia's 'Business and Political Elite' Have Been Receiving Experimental COVID-19 Vaccine,https://time.com/5868980/coronavirus-vaccine-russian-elite/?utm_source=feedburner&amp;utm_medium=feed&amp;utm_campaign=Feed%3A+time%2Ftopstories+%28TIME%3A+Top+Stories%29,Coronavirus,29,/r/Coronavirus/comments/hup5wn/members_of_russias_business_and_political_elite/,time.com
1,"Britain secures 90 million possible COVID-19 vaccine doses from Pfizer/BioNTech, Valneva",https://in.reuters.com/article/health-coronavirus-britain-vaccines/britain-secures-90-million-possible-covid-19-vaccine-doses-from-pfizer-biontech-valneva-idINKCN24L0J8?il=0,Coronavirus,19,/r/Coronavirus/comments/huoqd0/britain_secures_90_million_possible_covid19/,reuters.com
1,"Covid-19 news: Oxford vaccine is safe and induces immune response. (this was posted before from a news source I've never heard of. This is from New Scientists, further confirming the good news)",https://www.newscientist.com/article/2237475-covid-19-news-oxford-vaccine-is-safe-and-induces-immune-response/,Coronavirus,11,/r/Coronavirus/comments/huok2x/covid19_news_oxford_vaccine_is_safe_and_induces/,newscientist.com
