class,title,url,subreddit,score,permalink,Source
1,COVID-19: Cases of vaccine-resistant variant more than doubles in B.C.,https://vancouversun.com/news/covid-19-cases-of-vaccine-resistant-variant-more-than-doubles-in-b-c,Coronavirus,8,/r/Coronavirus/comments/mfc0px/covid19_cases_of_vaccineresistant_variant_more/,vancouversun.com
1,Should A COVID Vaccine Be Part Of The Back-To-School Routine For College And University Students And Staff?,https://chicago.cbslocal.com/2021/03/26/should-a-covid-vaccine-be-part-of-the-back-to-school-routine-for-college-and-university-students-and-staff/,Coronavirus,4,/r/Coronavirus/comments/mf8f9x/should_a_covid_vaccine_be_part_of_the/,cbslocal.com
1,UK hits 30 million first vaccine doses - 57% of all adults,https://news.sky.com/story/covid-19-uk-hits-30-million-first-vaccine-doses-12259255,Coronavirus,5,/r/Coronavirus/comments/mf2gfh/uk_hits_30_million_first_vaccine_doses_57_of_all/,sky.com
1,EU medical regulator says AstraZeneca COVID vaccine does not causes blood clots,https://www.dw.com/en/coronavirus-eu-medical-regulator-says-astrazeneca-covid-vaccine-does-not-causes-blood-clots/a-56887985,Coronavirus,4,/r/Coronavirus/comments/m69371/eu_medical_regulator_says_astrazeneca_covid/,dw.com
1,Moderna begins testing next-generation coronavirus vaccine,https://www.reuters.com/article/idUSKBN2B71OE,Coronavirus,4,/r/Coronavirus/comments/m5wj9z/moderna_begins_testing_nextgeneration_coronavirus/,reuters.com
1,There's no proof the Oxford vaccine causes blood clots. So why are people worried?,https://www.theguardian.com/commentisfree/2021/mar/15/evidence-oxford-vaccine-blood-clots-data-causal-links,Coronavirus,4,/r/Coronavirus/comments/m5w8sn/theres_no_proof_the_oxford_vaccine_causes_blood/,theguardian.com
1,EU's Breton says Pfizer can help offset AstraZeneca vaccine delays,https://www.reuters.com/article/us-health-coronavirus-eu-breton-idUSKBN2B60A7,Coronavirus,6,/r/Coronavirus/comments/m4y2yb/eus_breton_says_pfizer_can_help_offset/,reuters.com
1,"Initial data from Israeli study show the Pfizer vaccine could improve and even cure ""long covid"" symptoms",http://www.kikar.co.il/387470,Coronavirus,4,/r/Coronavirus/comments/m4xysu/initial_data_from_israeli_study_show_the_pfizer/,co.il
1,"Colorado to make all adults eligible for COVID-19 vaccine by mid-April, Gov. Jared Polis says",https://www.denverpost.com/2021/03/12/colorado-covid-vaccine-eligibility-april/,Coronavirus,17,/r/Coronavirus/comments/m4jgfx/colorado_to_make_all_adults_eligible_for_covid19/,denverpost.com
1,"Covid vaccine UAE: 53,836 doses administered in 24 hours",https://www.khaleejtimes.com/coronavirus-pandemic/covid-vaccine-uae-53836-doses-administered-in-24-hours,Coronavirus,4,/r/Coronavirus/comments/m4ixl3/covid_vaccine_uae_53836_doses_administered_in_24/,khaleejtimes.com
1,Resources for finding a COVID-19 vaccine appointment,https://www.reddit.com/r/Coronavirus/comments/m4ir9q/resources_for_finding_a_covid19_vaccine/,Coronavirus,24,/r/Coronavirus/comments/m4ir9q/resources_for_finding_a_covid19_vaccine/,reddit.com
1,"Tel Aviv tells teachers: No vaccine, no work",https://www.allisrael.com/tel-aviv-tells-teachers-no-vaccine-no-work,Coronavirus,11,/r/Coronavirus/comments/m4ipb7/tel_aviv_tells_teachers_no_vaccine_no_work/,allisrael.com
1,"People near and far travel to New Hartford, NY to specifically get the Johnson & Johnson COVID-19 vaccine",https://www.wktv.com/content/news/People-near-and-far-travel-to-New-Hartford-to-specifically-get-the-Johnson--Johnson-COVID-19-vaccine-573984061.html,Coronavirus,7,/r/Coronavirus/comments/m4ilem/people_near_and_far_travel_to_new_hartford_ny_to/,wktv.com
1,"Tracking the coronavirus vaccine, state by state",https://www.washingtonpost.com/graphics/2020/health/covid-vaccine-states-distribution-doses/,Coronavirus,7,/r/Coronavirus/comments/m4ib4w/tracking_the_coronavirus_vaccine_state_by_state/,washingtonpost.com
1,Millions more Californians will be eligible for COVID-19 vaccine. But they face obstacles,https://www.latimes.com/california/story/2021-03-13/vaccine-high-risk-eligible,Coronavirus,8,/r/Coronavirus/comments/m4ht1u/millions_more_californians_will_be_eligible_for/,latimes.com
1,Brazilian Northeast governors formally purchase 37 million doses of Sputnik V; vaccine enters the National Immunization Plan,https://g1.globo.com/pi/piaui/noticia/2021/03/13/governadores-do-nordeste-formalizam-compra-de-37-milhoes-da-sputnik-v.ghtml,Coronavirus,4,/r/Coronavirus/comments/m4hrts/brazilian_northeast_governors_formally_purchase/,globo.com
1,Brazil's health ministry to buy 10 million doses of Russia's sputnik covid-19 vaccine,https://www.reuters.com/article/us-health-coronavirus-brazil-sputnik/brazils-health-ministry-to-buy-10-million-doses-of-russias-sputnik-covid-19-vaccine-idUSKBN2B42LF,Coronavirus,12,/r/Coronavirus/comments/m4h1iq/brazils_health_ministry_to_buy_10_million_doses/,reuters.com
1,"AstraZeneca, another case in Sicily after the vaccine: in serious condition a 37-year-old teacher (Italian, translation in comments)",https://www.lastampa.it/cronaca/2021/03/13/news/astrazeneca-un-altro-caso-in-sicilia-dopo-il-vaccino-in-gravi-condizioni-un-insegnante-di-37-anni-1.40022800,Coronavirus,12,/r/Coronavirus/comments/m4gnbo/astrazeneca_another_case_in_sicily_after_the/,lastampa.it
1,Covid19 vaccine milestone: 1% of the world's population has now been fully vaccinated (77 million people injected twice).,https://covidvax.live/,Coronavirus,15,/r/Coronavirus/comments/m4fwx2/covid19_vaccine_milestone_1_of_the_worlds/,covidvax.live
1,"'Over-supplied' US faces pressure to send Covid vaccine doses to less wealthy countries: US bought enough doses to vaccinate whole eligible population twice, but continues to resist sharing in effort to ‘over-prepare’",https://www.theguardian.com/world/2021/mar/13/us-faces-pressure-send-covid-vaccine-doses-less-wealthy-countries-biden,Coronavirus,8,/r/Coronavirus/comments/m4fw2f/oversupplied_us_faces_pressure_to_send_covid/,theguardian.com
1,How long after the second dose of the COVID vaccine is it effective?,https://fox59.com/news/how-long-after-the-second-dose-of-the-covid-vaccine-is-it-effective/,Coronavirus,5,/r/Coronavirus/comments/m4fr4c/how_long_after_the_second_dose_of_the_covid/,fox59.com
1,Woman At Age Of 38 Dies In Slovakia After Getting AstraZeneca COVID-19 Vaccine,https://www.urdupoint.com/en/world/woman-at-age-of-38-dies-in-slovakia-after-get-1192759.html,Coronavirus,9,/r/Coronavirus/comments/m4fmmg/woman_at_age_of_38_dies_in_slovakia_after_getting/,urdupoint.com
1,Norway to receive up to one million fewer doses of AstraZeneca vaccine,https://www.thelocal.no/20210312/norway-to-receive-up-to-one-million-fewer-doses-of-astrazeneca-vaccine/,Coronavirus,10,/r/Coronavirus/comments/m4f3aw/norway_to_receive_up_to_one_million_fewer_doses/,thelocal.no
1,States herald good news: Vaccine production is heating up,https://abcnews.go.com/Health/states-herald-good-news-vaccine-production-heating/story?id=76425739,Coronavirus,18,/r/Coronavirus/comments/m4dutk/states_herald_good_news_vaccine_production_is/,go.com
1,Blind Americans Face Roadblocks Booking Online Vaccine Appointments,https://www.necn.com/news/coronavirus/blind-americans-face-roadblocks-booking-online-vaccine-appointments/2425305/,Coronavirus,7,/r/Coronavirus/comments/m4cyqj/blind_americans_face_roadblocks_booking_online/,necn.com
1,"‘I almost made it’: Close to a vaccine, these Americans got covid-19 instead",https://www.washingtonpost.com/local/caught-covid-before-vaccine/2021/03/12/4521efaa-80e6-11eb-81db-b02f0398f49a_story.html,Coronavirus,6,/r/Coronavirus/comments/m4ctyh/i_almost_made_it_close_to_a_vaccine_these/,washingtonpost.com
1,'We don't want to die': Local doctors write letter pleading for COVID-19 vaccine,https://edmonton.ctvnews.ca/we-don-t-want-to-die-local-doctors-write-letter-pleading-for-covid-19-vaccine-1.5345798,Coronavirus,7,/r/Coronavirus/comments/m4c9ii/we_dont_want_to_die_local_doctors_write_letter/,ctvnews.ca
1,EU closes ranks over Covid surge and vaccine delays,https://www.bbc.com/news/world-europe-56361840,Coronavirus,4,/r/Coronavirus/comments/m4as8y/eu_closes_ranks_over_covid_surge_and_vaccine/,bbc.com
1,"Three health workers who received AstraZeneca vaccine in hospital with ""unusual"" symptoms, Norway says",https://www.reuters.com/article/us-health-coronavirus-norway-idUSKBN2B50GZ,Coronavirus,5,/r/Coronavirus/comments/m4acy8/three_health_workers_who_received_astrazeneca/,reuters.com
1,"Jacksonville, FL: Caregivers who bring someone 65 and older to get COVID-19 vaccine, can also get one",https://www.actionnewsjax.com/news/local/duval-county/one-day-bring-someone-65-older-get-covid-19-vaccine-get-one-yourself-gateway-mall-vaccination-site/7ZXL2K3AA5HYTJNDXKEGJVCKLQ/,Coronavirus,4,/r/Coronavirus/comments/m3i24b/jacksonville_fl_caregivers_who_bring_someone_65/,actionnewsjax.com
1,An Austrian Region Becomes a Coronavirus Vaccine Laboratory,https://www.nytimes.com/2021/03/04/world/europe/austria-south-africa-variant.html,Coronavirus,26,/r/Coronavirus/comments/ly8mzn/an_austrian_region_becomes_a_coronavirus_vaccine/,nytimes.com
1,Covid: Italy blocks AstraZeneca vaccine shipment to Australia,https://www.bbc.com/news/world-europe-56279202,Coronavirus,6,/r/Coronavirus/comments/ly8jdu/covid_italy_blocks_astrazeneca_vaccine_shipment/,bbc.com
1,[Spain] ‘The best coronavirus vaccine is the one that reaches my arm first’,https://english.elpais.com/society/2021-03-04/the-best-coronavirus-vaccine-is-the-one-that-reaches-my-arm-first.html,Coronavirus,278,/r/Coronavirus/comments/ly8brl/spain_the_best_coronavirus_vaccine_is_the_one/,elpais.com
0,Sinovac vaccine may not trigger sufficient antibody response to Brazil variant,https://www.reuters.com/article/us-health-coronavirus-vaccine-sinovac-idUSKBN2AX0KK,Coronavirus,21,/r/Coronavirus/comments/ly7hwd/sinovac_vaccine_may_not_trigger_sufficient/,reuters.com
1,(India) More than 1 million Covid-19 vaccine doses given in a day,https://www.hindustantimes.com/india-news/more-than-1-million-covid-19-vaccine-doses-given-in-a-day-government-101614878862848.html,Coronavirus,27,/r/Coronavirus/comments/ly5p0j/india_more_than_1_million_covid19_vaccine_doses/,hindustantimes.com
1,Corning Incorporated making millions of vials for COVID-19 vaccine,https://www.wgrz.com/article/news/local/corning-incorporated-making-millions-of-vials-for-covid-19-vaccine/71-0ad00483-6849-46e5-bac4-6f012a89240b,Coronavirus,15,/r/Coronavirus/comments/ly4ydl/corning_incorporated_making_millions_of_vials_for/,wgrz.com
0,The next wave of vaccine eligibility criteria is a smudgy mess,https://www.washingtonpost.com/opinions/2021/03/04/next-wave-vaccine-eligibility-criteria-is-smudgy-mess/,Coronavirus,34,/r/Coronavirus/comments/ly3hyp/the_next_wave_of_vaccine_eligibility_criteria_is/,washingtonpost.com
1,"COVID-19 vaccine confidence is growing, global survey suggests",https://www.imperial.ac.uk/news/216493/covid-19-vaccine-confidence-growing-global-survey/,Coronavirus,7,/r/Coronavirus/comments/ly30nl/covid19_vaccine_confidence_is_growing_global/,ac.uk
1,COVID-19 vaccine confidence grows as side effect worries fade,https://www.reuters.com/article/idUSKCN2AX008?il=0&amp;utm_source=reddit.com,Coronavirus,269,/r/Coronavirus/comments/ly2cwj/covid19_vaccine_confidence_grows_as_side_effect/,reuters.com
1,Novavax Makes Deal with Polish Company to Potentially Produce Covid-19 Vaccine,https://www.bloomberg.com/news/articles/2021-03-03/novavax-deal-with-mabion-boosts-poland-s-nascent-biotech-scene?sref=3JQVfxnw,Coronavirus,30,/r/Coronavirus/comments/ly29ls/novavax_makes_deal_with_polish_company_to/,bloomberg.com
1,"One Arizona county has so many vaccine doses, it's now able to offer them to anyone over 18",https://www.cnn.com/2021/03/04/health/gila-county-arizona-vaccine-trnd/index.html,Coronavirus,1530,/r/Coronavirus/comments/ly1itw/one_arizona_county_has_so_many_vaccine_doses_its/,cnn.com
1,Vaccine nationalism will block our path out of the pandemic – so how do we resist our tribal instinct?,https://theconversation.com/vaccine-nationalism-will-block-our-path-out-of-the-pandemic-so-how-do-we-resist-our-tribal-instinct-155258,Coronavirus,7,/r/Coronavirus/comments/ly0r5y/vaccine_nationalism_will_block_our_path_out_of/,theconversation.com
1,Nearly All Indonesian Medical Workers Have Received First Dose of Covid-19 Vaccine,https://jakartaglobe.id/news/nearly-all-indonesian-medical-workers-have-received-first-dose-of-covid19-vaccine,Coronavirus,43,/r/Coronavirus/comments/ly0fbo/nearly_all_indonesian_medical_workers_have/,jakartaglobe.id
1,Public health officials: Johnson and Johnson vaccine will be easier to distribute to underserved communities,https://www.nytimes.com/2021/03/04/health/covid-vaccine-johnson-and-johnson-rollout.html?referringSource=articleShare,Coronavirus,116,/r/Coronavirus/comments/ly07ta/public_health_officials_johnson_and_johnson/,nytimes.com
1,People who have had COVID-19 might need only one shot of a coronavirus vaccine,https://www.sciencenews.org/article/covid-19-infection-one-shot-two-dose-coronavirus-vaccine,Coronavirus,38,/r/Coronavirus/comments/lxzuax/people_who_have_had_covid19_might_need_only_one/,sciencenews.org
1,Cuban-developed vaccine enters Phase III trial,https://www.france24.com/en/live-news/20210304-cuban-developed-vaccine-enters-phase-iii-trial,Coronavirus,32,/r/Coronavirus/comments/lxz3nq/cubandeveloped_vaccine_enters_phase_iii_trial/,france24.com
1,More Than 100K United Center COVID Vaccine Appointments to Open Thursday,https://www.nbcchicago.com/news/coronavirus/united-center-covid-vaccine-appointments-to-open-thursday-chicagos-top-doctor-says/2451451/,Coronavirus,66,/r/Coronavirus/comments/lxw4p1/more_than_100k_united_center_covid_vaccine/,nbcchicago.com
0,'Falling through cracks': Vaccine bypasses some older adults,https://apnews.com/article/coronavirus-vaccine-bypass-some-older-adults-374da36856dd9428643db2c3e85564da,Coronavirus,12,/r/Coronavirus/comments/lxvpwl/falling_through_cracks_vaccine_bypasses_some/,apnews.com
1,Great apes at San Diego Zoo receive experimental COVID-19 vaccine for animals,https://www.cnet.com/news/great-apes-at-san-diego-zoo-receive-experimental-covid-19-vaccine-for-animals/,Coronavirus,26,/r/Coronavirus/comments/lxv8j0/great_apes_at_san_diego_zoo_receive_experimental/,cnet.com
1,"4,300 Allegedly Received Wrong COVID-19 Vaccine Dosage In California, State Denies Claims",https://www.ibtimes.com/4300-allegedly-received-wrong-covid-19-vaccine-dosage-california-state-denies-claims-3155968,Coronavirus,20,/r/Coronavirus/comments/lxv8aj/4300_allegedly_received_wrong_covid19_vaccine/,ibtimes.com
1,"Italy blocks export of Covid-19 vaccine doses to Australia, using EU powers for the first time",https://edition.cnn.com/2021/03/04/europe/italy-astrazeneca-doses-australia-intl/index.html,Coronavirus,11,/r/Coronavirus/comments/lxsf38/italy_blocks_export_of_covid19_vaccine_doses_to/,cnn.com
1,Russia's Sputnik V vaccine expands its reach in Latin America,https://www.cnn.com/2021/03/03/americas/sputnik-latin-america-spreads-intl-latam/index.html,Coronavirus,29,/r/Coronavirus/comments/lxs5x7/russias_sputnik_v_vaccine_expands_its_reach_in/,cnn.com
1,Italy and EU block Oxford-AstraZeneca vaccine shipment to Australia as shortages row escalates,http://news.sky.com/story/covid-19-italy-and-eu-block-oxford-vaccine-shipment-to-australia-12235848,Coronavirus,15,/r/Coronavirus/comments/lxrkgk/italy_and_eu_block_oxfordastrazeneca_vaccine/,sky.com
1,Secrets of a Covid-19 Vaccine-Appointment Master: Advice for Any State,https://www.wsj.com/video/series/joanna-stern-personal-technology/secrets-of-a-covid-19-vaccine-appointment-master-advice-for-any-state/70F70C0D-41E6-4F11-854C-766ACA419891,Coronavirus,26,/r/Coronavirus/comments/lxrgdw/secrets_of_a_covid19_vaccineappointment_master/,wsj.com
1,Largest Vaccine Maker Warns of Delays as U.S. Prioritizes Pfizer,https://www.bloomberg.com/news/articles/2021-03-04/largest-vaccine-maker-warns-of-delays-as-u-s-prioritizes-pfizer,Coronavirus,215,/r/Coronavirus/comments/lxqdnc/largest_vaccine_maker_warns_of_delays_as_us/,bloomberg.com
1,COVID-19 vaccine is tough to find unless you're an internet genius with broadband,https://www.cnet.com/features/covid-19-vaccine-is-tough-to-find-unless-youre-an-internet-genius-with-broadband/,Coronavirus,24,/r/Coronavirus/comments/lxq5h9/covid19_vaccine_is_tough_to_find_unless_youre_an/,cnet.com
0,Delayed Large Local Reactions to mRNA-1273 Vaccine against SARS-CoV-2,https://www.nejm.org/doi/full/10.1056/NEJMc2102131,Coronavirus,17,/r/Coronavirus/comments/lxodv1/delayed_large_local_reactions_to_mrna1273_vaccine/,nejm.org
1,Canada's Vaccine Panel Recommends 4 Months Between COVID Doses - The Wire Science,https://science.thewire.in/health/canadas-vaccine-panel-recommends-4-months-between-covid-doses/,Coronavirus,34,/r/Coronavirus/comments/lxo8gf/canadas_vaccine_panel_recommends_4_months_between/,thewire.in
1,Covid: Germany approves AstraZeneca vaccine for over-65s,https://www.bbc.co.uk/news/world-europe-56275342,Coronavirus,83,/r/Coronavirus/comments/lxo089/covid_germany_approves_astrazeneca_vaccine_for/,co.uk
1,California to allocate 40% of COVID-19 vaccine doses to vulnerable neighborhoods,https://abc7.com/health/california-to-give-40%25-of-vaccine-doses-to-vulnerable-areas/10387415/,Coronavirus,101,/r/Coronavirus/comments/lxmolk/california_to_allocate_40_of_covid19_vaccine/,abc7.com
1,Italy blocks shipment of Oxford/AstraZeneca vaccine to Australia,https://www.ft.com/content/bed655ac-9285-486a-b5ad-b015284798c8,Coronavirus,484,/r/Coronavirus/comments/lxm71s/italy_blocks_shipment_of_oxfordastrazeneca/,ft.com
1,"CureVac and Novartis Sign Initial Agreement on Manufacturing of COVID-19 Vaccine Candidate, CVnCoV",https://www.curevac.com/en/2021/03/04/curevac-and-novartis-sign-initial-agreement-on-manufacturing-of-covid-19-vaccine-candidate-cvncov/,Coronavirus,41,/r/Coronavirus/comments/lxluok/curevac_and_novartis_sign_initial_agreement_on/,curevac.com
1,Can my employer make me get a COVID-19 vaccine?,https://news.trust.org/item/20210119174126-u21v4/,Coronavirus,9,/r/Coronavirus/comments/lxleja/can_my_employer_make_me_get_a_covid19_vaccine/,trust.org
1,Great apes at San Diego Zoo become first non-humans to receive COVID-19 vaccine,https://www.cbsnews.com/news/great-apes-san-diego-zoo-receive-covid-19-vaccine/,Coronavirus,89,/r/Coronavirus/comments/lxkyzw/great_apes_at_san_diego_zoo_become_first/,cbsnews.com
1,Bharat Biotech’s Covaxin Covid-19 Vaccine has around 81% efficacy: What does this mean for India?,https://indianexpress.com/article/explained/bharat-biotechs-covaxin-has-around-81-efficacy-what-does-this-mean-for-india-7212855/,Coronavirus,24,/r/Coronavirus/comments/lxktjf/bharat_biotechs_covaxin_covid19_vaccine_has/,indianexpress.com
1,"Accidentally Trashed, Thawed Or Expired: Reports Of COVID Vaccine 'Spoilage' Grow",https://www.npr.org/sections/health-shots/2021/03/04/973412955/accidentally-trashed-thawed-or-expired-reports-of-covid-vaccine-spoilage-grow,Coronavirus,164,/r/Coronavirus/comments/lxk61n/accidentally_trashed_thawed_or_expired_reports_of/,npr.org
1,"Zimbabwe approves Covaxin, first in Africa to okay India-made Covid-19 vaccine",https://www.hindustantimes.com/world-news/zimbabwe-approves-covaxin-first-in-africa-to-okay-india-made-covid-19-vaccine-101614859597880.html,Coronavirus,103,/r/Coronavirus/comments/lxk2m2/zimbabwe_approves_covaxin_first_in_africa_to_okay/,hindustantimes.com
1,Unions attack 'sinister' plan to force NHS staff to have Covid vaccine,https://www.theguardian.com/society/2021/mar/03/unions-attack-sinister-plan-to-force-nhs-staff-to-have-covid-vaccine,Coronavirus,18,/r/Coronavirus/comments/lxjxl0/unions_attack_sinister_plan_to_force_nhs_staff_to/,theguardian.com
1,Three vaccines. Increased manufacturing. How US will have enough COVID-19 vaccine for every US adult in May – or even sooner.,https://www.usatoday.com/story/news/health/2021/03/04/covid-19-vaccine-joe-biden-promise-coronavirus/6896798002/,Coronavirus,589,/r/Coronavirus/comments/lxjowj/three_vaccines_increased_manufacturing_how_us/,usatoday.com
1,Germans' rejection of Oxford-AstraZeneca vaccine hinders COVID fight,https://www.cbsnews.com/news/covid-vaccine-oxford-astrazeneca-germany-rejection-coronavirus-europe/,Coronavirus,30,/r/Coronavirus/comments/lxjnrm/germans_rejection_of_oxfordastrazeneca_vaccine/,cbsnews.com
1,UK could be one of fastest countries to approve new Covid vaccine for variants | ITV News,https://www.itv.com/news/2021-03-04/modified-covid-vaccines-for-variants-could-be-fast-tracked-and-approved-quickly-in-uk,Coronavirus,39,/r/Coronavirus/comments/lxjfsb/uk_could_be_one_of_fastest_countries_to_approve/,itv.com
1,"Canada thanks India as 500,000 doses of Covishield COVID-19 vaccine arrives",https://www.freepressjournal.in/india/canada-thanks-india-as-500000-doses-of-covishield-covid-19-vaccine-arrives,Coronavirus,364,/r/Coronavirus/comments/lxjaky/canada_thanks_india_as_500000_doses_of_covishield/,freepressjournal.in
1,Germany changes guidance and recommends Oxford-AstraZeneca vaccine for over-65,https://news.sky.com/story/germany-changes-guidance-and-recommends-oxford-astrazeneca-vaccine-for-over-65s-12235622,Coronavirus,265,/r/Coronavirus/comments/lxj94p/germany_changes_guidance_and_recommends/,sky.com
1,Ron DeSantis blasted after wealthy Florida Keys community Ocean Reef Club gets vaccine access,https://www.washingtonpost.com/nation/2021/03/04/florida-keys-desantis-vaccine-donation/,Coronavirus,231,/r/Coronavirus/comments/lxj5sl/ron_desantis_blasted_after_wealthy_florida_keys/,washingtonpost.com
1,More than four in 10 over-80s in England breaking lockdown rules after receiving one vaccine dos,https://www.theguardian.com/world/live/2021/mar/04/coronavirus-live-news-covid-death-rates-10-times-higher-in-countries-where-most-adults-overweight?page=with:block-6040c11d8f08a1b4c6d72af2#block-6040c11d8f08a1b4c6d72af2,Coronavirus,192,/r/Coronavirus/comments/lxiron/more_than_four_in_10_over80s_in_england_breaking/,theguardian.com
1,European Union begins review of Russia’s Sputnik Covid vaccine,https://www.cnbc.com/2021/03/04/covid-vaccine-ema-starts-review-of-russia-sputnik-v-jab.html,Coronavirus,45,/r/Coronavirus/comments/lximdw/european_union_begins_review_of_russias_sputnik/,cnbc.com
1,The European Medicines Agency has started a rolling review of Russia's Sputnik V coronavirus vaccine,https://apnews.com/7160f856fdb5b0d2a858ed4182ea5ad0,Coronavirus,30,/r/Coronavirus/comments/lxi8c7/the_european_medicines_agency_has_started_a/,apnews.com
1,"After India Jabs Millions, Its Covid-19 Vaccine Shows Potency",https://www.nytimes.com/2021/03/04/world/asia/india-coronavirus-vaccine-covaxin.html,Coronavirus,12,/r/Coronavirus/comments/lxi5r9/after_india_jabs_millions_its_covid19_vaccine/,nytimes.com
1,Budget: Chancellor Rishi Sunak to announce £1.7bn cash injection for vaccine programme,https://news.sky.com/story/budget-chancellor-rishi-sunak-to-announce-16317bn-cash-injection-for-vaccine-programme-12232205,Coronavirus,10,/r/Coronavirus/comments/lxhsqd/budget_chancellor_rishi_sunak_to_announce_17bn/,sky.com
1,EU regulator starts a review of Russia’s COVID-19 vaccine,https://www.fresnobee.com/news/article249683823.html,Coronavirus,16,/r/Coronavirus/comments/lxhnr1/eu_regulator_starts_a_review_of_russias_covid19/,fresnobee.com
1,EU sends variant-hit Austria more vaccine doses,https://www.dw.com/en/coronavirus-digest-eu-sends-austria-extra-vaccine-doses/a-56762731,Coronavirus,29,/r/Coronavirus/comments/lxhj3t/eu_sends_varianthit_austria_more_vaccine_doses/,dw.com
1,India’s Bharat Biotech says its Covaxin coronavirus vaccine is 81 per cent effective,https://www.scmp.com/news/asia/south-asia/article/3124020/indias-bharat-biotech-says-its-covaxin-coronavirus-vaccine-81,Coronavirus,82,/r/Coronavirus/comments/lxgkcl/indias_bharat_biotech_says_its_covaxin/,scmp.com
1,EMA starts rolling review of the Sputnik V COVID-19 vaccine - European Medicines Agency,https://www.ema.europa.eu/en/news/ema-starts-rolling-review-sputnik-v-covid-19-vaccine,Coronavirus,54,/r/Coronavirus/comments/lxgjrx/ema_starts_rolling_review_of_the_sputnik_v/,europa.eu
1,EU to propose Covid-19 vaccine passports in March,https://www.france24.com/en/europe/20210301-eu-to-propose-covid-19-vaccine-passports-in-march,Coronavirus,12,/r/Coronavirus/comments/lxg75z/eu_to_propose_covid19_vaccine_passports_in_march/,france24.com
1,Thailand Kicks Off Covid-19 Vaccine Program With Sinovac Shots,https://www.bloomberg.com/news/articles/2021-02-28/thailand-kicks-off-covid-19-vaccine-program-with-sinovac-shots,Coronavirus,17,/r/Coronavirus/comments/lxg6wn/thailand_kicks_off_covid19_vaccine_program_with/,bloomberg.com
1,[Spain] Political parties slam Spanish king’s sisters for jumping Covid-19 vaccine line on trip to Abu Dhabi,https://english.elpais.com/spanish_news/2021-03-03/political-parties-slam-spanish-kings-sisters-for-jumping-covid-19-vaccine-line-on-trip-to-abu-dhabi.html,Coronavirus,22,/r/Coronavirus/comments/lxfalv/spain_political_parties_slam_spanish_kings/,elpais.com
1,How AstraZeneca's vaccine got mired in politics and mistrust to become Europe's least favorite shot,https://www.businessinsider.in/science/news/how-astrazenecas-vaccine-got-mired-in-politics-and-mistrust-to-become-europes-least-favorite-shot/articleshow/81311737.cms,Coronavirus,34,/r/Coronavirus/comments/lxdzra/how_astrazenecas_vaccine_got_mired_in_politics/,businessinsider.in
1,California to give 40% of vaccine doses to vulnerable areas,https://www.radio.com/knx1070/news/national/california-to-give-40-of-vaccine-doses-to-vulnerable-areas,Coronavirus,29,/r/Coronavirus/comments/lxdoqu/california_to_give_40_of_vaccine_doses_to/,radio.com
